incoming,text
"Murder both of them.","You take out the immiediate threat first, blowing Salvucci's mind out the back of his skull. The captain slumps.\n\nNeil puts his hand up to block the next round but the bullet tears through his palm and into his chest. He takes a step backward. You fire another shot. He falls back onto the console.\n\nGood child, the voice says. Now set a course for the human world.\n\nYou approach the console, pushing Neil's corpse out of the way. Neil was logged in, luckily. You play around with the settings until you find the autopilot and set a course for Mars.\n\nThe voice tells you it's proud of you and that great things await. It tells you to wait, so you do. Later on, your body seizes and you flop to the ground like a fish. You watch with a mixture of horror and fascination as your arm explodes, spraying blood, skin, and bone everywhere, to reveal a purple jagged claw.\n\nNow, the voice says, your work truly begins. You follow its instructions and penetrate the chest cavities of Meat, Neil, and Salvucci with your claw. An hour later they've all risen. Of course, they're not really the people you knew. They're walking cocoons, dead flesh nuturing future soldiers.\n\nIt strikes you as odd that you should feel no guilt, but you chalk it up to how quickly you're evolving. Maybe guilt was, after all, a weakness that needed to be culled. The closer you get to Mars, the more changes your body undergoes. \n\nFirst, another claw sprouts. Next, in your sleep, you lose your skin and find it replaced with a hard shell-like body. You teeth fall from your mouth and are replaced with the kind of teeth monsters in fairy tales have.\n\nWhen you're a day away from the red planet, your soldiers hatch. They look like smaller versions of you.\n\nThey are to obey your every command, the voice says. Do not disappoint us, child.\n \nSoon you have forgotten your human life and have not only come to terms with what you are, but you look forward to your duties. The descendents of your new species will sing songs of your exploits and worship the very ground you have tread.\n\nMars looms and with it, your future.\n\nThe End\n\n"
"""Don't you say a goddamn word to me.""","“I guess I shouldn’t expect kindness from any of you, though I only did what had to be done.”\n\nMeat lights the rag and then tosses the bottle at the corpses. Ben goes up in flames quickly. The captain isn’t far behind.\n\n“Come on, let’s go,” Neil says.\n\n“Yes,” Strauss says. “Anywhere but here.”\n\n“Sure you don’t want to watch your boyfriend barbecue?” Meat says.\n\nStrauss gives him a look of pure malice and then walks around the corner.\n\nNeil waits until she’s out of sight. “What now?”\n\nMeat looks at him. “We’re not done hunting.”\n\n“Did either of you get the captain’s pistol?”\n\n“Yeah, it didn’t have any ammo in it, though. That’s not good. Man is…was a crackshot. That thing probably soaked up all those bullets like a sponge.”\n\n“We’ll have to improvise.”\n\nThe three of you leave. You don’t look back at the bodies, but you can hear the flesh crackling.\n\nStrauss is waiting for you down the hallway, arms folded, the stony quality of her face fully returned. “What now?” she says.\n\n“We find the other one and kill it.”\n\n“Yes, but how precisely? What’s our strategy?”\n\n1.[["""We need someone up in the vents."""]]\n"
"""I really should have let him kill you.""","Meat lights the rag and then tosses the bottle at the corpses. Ben goes up in flames quickly. The captain isn’t far behind.\n\n“Come on, let’s go,” Neil says.\n\n“Yes,” Strauss says. “Anywhere but here.”\n\n“Sure you don’t want to watch your boyfriend barbecue?” Meat says.\n\nStrauss gives him a look of pure malice and then walks around the corner.\n\nNeil waits until she’s out of sight. “What now?”\n\nMeat looks at him. “We’re not done hunting.”\n\n“Did either of you get the captain’s pistol?”\n\n“Yeah, it didn’t have any ammo in it, though. That’s not good. Man is…was a crackshot. That thing probably soaked up all those bullets like a sponge.”\n\n“We’ll have to improvise.”\n\nThe three of you leave. You don’t look back at the bodies, but you can hear the flesh crackling.\n\nStrauss is waiting for you down the hallway, arms folded, the stony quality of her face fully returned. “What now?” she says.\n\n“We find the other one and kill it.”\n\n“Yes, but how precisely? What’s our strategy?”\n\n1.[["""We need someone up in the vents."""]]\n"
"Run away.","You both retreat.\n\n"""Neil,""" he yells into the comm. """Bring the Speedwell to the LZ. We need some fucking help here."""\n\n"""Coming as fast I can,""" Neil replies.\n\nYou run and run and run. You lose feeling in your legs but somehow manage to keep going full speed anyway. Near the end, you swear that your heart is going to burst and that your lungs will catch on fire, but you eventually stumble out of the tunnel into the irradiated light of dusk.\n\nAcross the way, you see Markie running by herself--her suit covered in what appears to be blood. Ryan is nowhere to be seen. You’ve covered half the distance to her when, looking up, you see the Speedwell beginning its descent.\n\nWhen you reach her, you take her by the arm and look through her visor. Her eyes are wild and she's sweating.\n\n"""Markie,""" Meat says, """where's Ryan?"""\n\nShe stutters. """D...d..dead."""\n\n"""Fuck!""" He turns back to the hole you and he emerged from. The wave of crabs has reached the mouth of the cave. In the light, they're purple and fungal looking.\n\nHe fires some shots at them while you tend to Markie. Her arm is wounded.\n\n1.[[“Are you okay?”]]\n2. [[Remain silent and keep your hand over the tear in her suit.]]\n\n"
"""Look, all I know is that whatever we found on Earth wasn't human.""","“What killed Ryan?” Neil continues.\n\n“Stop talking, Neil,” Salvucci says with a raised voice before turning back to you. “Maybe Strauss was right.”\n\n“Captain, I have to insist. Ryan is a childhood buddy. I know his family. Somebody tell me what’s going on.”\n\n“Ryan got killed by some fucking thing,” Meat says. “Markie got bit by something else and is infected with a disease. Up to speed, dipshit? Let the adults talk now.”\n\nNeil sinks back into his chair. “He’s dead,” he says in disbelief.\n\n1. [[Give him a comfort pat and offer your condolences.]]\n2. [[Refrain from doing anything.]]"
"“I should have let him kill you.”","Meat lights the rag and then tosses the bottle at the corpses. Ben goes up in flames quickly. The captain isn’t far behind.\n\n“Come on, let’s go,” Neil says.\n\n“Yes,” Strauss says. “Anywhere but here.”\n\n“Sure you don’t want to watch your boyfriend barbecue?”\n\nStrauss gives him a look of pure malice and then walks around the corner.\n\nNeil waits until she’s out of sight. “What now?”\n\nMeat looks at him. “We’re not done hunting.”\n\n“Did either of you get the captain’s pistol?”\n\n“Yeah, it didn’t have any ammo in it, though. That’s not good. Man is…was a crackshot. That thing probably soaked up all those bullets like a sponge.”\n\n“We’ll have to improvise.”\n\nThe three of you leave.  You don’t look back at the bodies, but you can hear the flesh crackling.\n\nStrauss is waiting for you down the hallway, arms folded, the stony quality of her face fully returned. “What now?” she says.\n\n“We find the other one and kill it.”\n\n“Yes, but how, precisely? What’s our strategy?”\n\n1.[[“We need someone in the air ducts.”]]\n"
"""A bomb.""",""""Oh no no no no,""" Strauss says. She sticks her fingers in her mouth.\n\n"""What the hell are you doing, doctor?"""\n\nShe retches and pulls her fingers out. """What does it look like? We could be infected. Shit, we shouldn't even fucking be here right now. Get out!"""\n\nShe gets up and makes a dash for the door. The rest of you follow her into the hallway. """Showers,""" she yells.  She leads you to the shower stalls.\n\n"""Shouldn't we be using the one in your lab?""" Meat asks, taking his shirt off.\n\n"""Not enough time,""" she says, ripping off her shirt and bra, not bothering to cover her breasts. """Hurry!""" She rushes into one of the stall.\n\nYou disrobe and disappear into a stall of your own. Hot water washes over you, cleansing you of the gunk on your body.\n\n"""Wash your hair! Make sure every bit of you is clean!""" Strauss screams.\n\nYou shampoo and rinse your hair. You spend half an hour scrubbing yourself. When you step out, Meat thrusts a towel in your hands--his eyes closed--so you can cover yourself. You wrap yourself up and go to your locker to fetch your spare uniform. A couple of minutes later, you're dressed. You step back into the shower room to see Meat putting on his boots. Salvucci, Strauss, and Neil are there as well wearing their uniforms.\n\n1.[["""Everybody cool?"""]]"
"""Listen to me: this is not on you.""","“Yeah,” he says, not meeting your eyes. “Whatever. We need...we need to get this thing moving again. He gave you a password, right? Let's hope that console has autopilot or some shit. Worry about that motherfucker then."""\n\nThe two of you make your way toward the cockpit.\n\nA few minutes later you reach the cockpit door. Ben’s body is still there, as are the burnt remains of the captain.\n\n“Well, that’s good, all things considered,” says Meat. You step into the cockpit. The door slides shut behind you.\n\n“Here’s the computer.”\n\nYou step over to the main console. A password screen greets you. You type in “KONAMI.”\n\nThe screen changes to a selection of menus.\n\n“Here we go: autopilot” says Meat. He touches the screen and selects NEW AUSTIN. You head for the door.\n\n"""All right, good. We're set. Let's get the hell out of her--"""\nA tentacle sweeps through the door as soon as it opens and brushes both of you aside with a mighty swing. \n\nYou slam into the viewport, cracking the glass, and then fall to the floor. Looking up, you see the thing step into view: it’s monstrous, with a muscular human abdomen.\n\nThe thing’s face is distinctly unhuman with countless, slitted eyes glaring at you. The monster’s mouth is a vortex of meat and sharp teeth. Four tentacles protrude from its back, each one moving like a rattle snake.\n\nYou turn to look at Meat. He's being lifted into the air by one of the tentacles. His face turns red; he's slowly being choked to death.\n\nYou reach for your pistol.\n\n1. [[Risk your life to save Meat.]]\n2. [[Leave Meat to die and save yourself.]]"
"""She was infected. She killed Meat out of cowardice.""",""""God,""" Salvucci says.\n\n"""And then there were three,""" Neil says.\n\n"""We're probably infected too,""" Salvucci says quietfully.\n\n"""But there's been no symptoms yet."""\n\n"""What if they never show up until years later? When we're back on Mars."""\n\n"""Then a doctor could take care of us or something, man."""\n\nYou see Salvucci slowly reach for his pistol again. """I can't take that risk. If our survival puts humanity at risk..."""\n\n"""Cap,""" Neil says, backing into the wall. """Think straight here."""\n\n"""I'm sorry, pilot. I'm sure Zoe agrees."""\n\n1. [[Let Salvucci kill you.]]\n2. [[Kill him first.]]\n"
"“MOVE!”","Before the words can leave your mouth, there’s a whooshing sound followed by a giant spike tearing through Ryan’s chest, splattering the cave with red. Ryan’s pistol drops to the floor. He moans. \n\nYou cast your light on the protruding spike and realize, as your comrade is slowly being lifted in the air, that it’s a limb of some sort.\n\nMarkie’s voice barks over the comm. “Julia! What’s happening? Ryan’s vitals are dropping.” You fire several shots into the darkness. One of them slaps into Ryan’s arm; his blue eyes gaze at you in shock.\n\nMeat now: “Julia? Answer us, girl. What the hell is going on?”\n\n1.[[“Get the Speedwell here now!”]]\n2.[[“We’ve got to go!”]]\n3.[[“Something’s got Ryan!”]]\n"
"“Let’s check it out.”","“Ryan, let Captain Salvucci know what we’ve found. Let’s try and get a pick-up at the LZ in two hours.”\n\n“Aye.”\n\n“That thing loaded, Meat?”\n\n“Duh.”\n\n“Okay, I’m thinking we should split up to cover more ground. How should we do this?”\n\n1.[[“I’m with Ryan.”]]\n2.[[“I’m with Markie.”]]\n3.[[“I’m with Meat.”]]\n"
"""Oh good, that means your ass is useless in a fight.""",""""Yes,""" she says. """I guess it does, doesn't it?"""\n\nThe two of you proceed down the main hallway. The silence is heavy, and Strauss seems to be deep in her own thoughts.\n\n1.[[“What’s waiting for you back on Mars?"""]]\n2.[["""What’s up with you and Meat?"""]]"
"Shoot the both of them.","You put two rounds each into both of them. They're both dead before they hit the floor.\n\nWhat now?\n\n1. [[Wait it out.]]\n2. [[Kill yourself.]]\n\n\n"
"""Tempting. It was very, very tempting.""",""""Right? She's a total asshole. No doubt about it."""\n\nThe two of you enter the cafeteria and then, after taking a precautionary look around, you go into the kitchen and begin to stuff everything you can get your hands on into the two bags you brought from sickbay: fruit chips, soda, water bottles, pastries, canned soup.\n\nWhen you’ve filled the bags, you leave the cafeteria and make your way to the common room. Strauss, Neil, and Salvucci are waiting. The common room is a circular room with a couch, several chairs, and a large wall-mounted monitor connected a server archive of countless movies, shows, and documentaries.  \n\nOn the back wall, there are portholes—just like on the ships of old that sailed the waters of Earth—where you can gaze into the dark of space.\n\n“Run into any trouble?” Salvucci asks as you hand him the bag.\n\n“Didn’t see a damn thing,” Meat says.\n\n“I’m telling you,” Strauss says, rubbing her bandaged arm, “we won’t see it until it wants us to see it.”\n\nMeat grumbles something about paranoia and then heads over to the table, where Neil is setting up a checkers board.\n\n“How’s your arm, doctor?” Salvucci asks.\n\n“Fine, captain. Thank you.”\n\nYou're a bit tired.\n\nWhat should you do?\n\n1. [[Talk to Neil and Meat.]]\n2. [[Take a nap.]]"
"Leave without a word.","You hear him call your name as you turn and begin your sprint down the hall.\n\nIdiot, it says. I offered you evolution, wretch.\n\nBlood drips from your nose. There's a pain in your stomach. You have to hurry.\n\nYou reach the hanger within a minute and seal the door behind you. There's a wetness on your lips now. You taste nickles.\n\nYou approach the hanger door and place your hand over the release button. Your legs go numb and you fall to the floor, hand still held against the button. You press it and close your eyes. There's a whoosing sound as air is sucked past you, stinging your cheeks.\n\nThe first thing you feel is the cold. You open your eyes to see the Speedwell in all its glory as you drift away. The thing in your brain screams in anger and despair, but another voice cuts through. """Just let go,""" Markie says, her voice free of malice and madness.\n\nYou turn away from your ship and peer out across the ocean of [[stars]] to gaze at the sun in the far distance. It's quite pleasant from afar.\n\nYou take her advice.\n\nThe End\n"
"""It's not getting back up.""",""""Either way, we'll burn the corpses. Travis, take care of it."""\n\n"""On it,""" Meat says, leaving you two alone.\n\n"""Come on, we'll head to the cockpit. See if we can figure out how to fly this thing."""\n\nIf only it were that easy. You and Salvucci discover Neil's console locked.\n\n"""Did he ever tell you his password?"""\n\n1.[["""He didn't."""]]\n\n"
"“Hush now.”","But he doesn't. """Doctor Strauss left me here, and...and Markie chased her into the hallway. I can't believe she did that."""\n\nHe turns to you, eyes welling with tears. \n\n1. [[Move to comfort him]]\n2. [[Don't touch him]]"
"""Don't get killed.""",""""Will try,""" she says and then takes off running and screaming, """Help!"""\n\n"""Five minutes,"""  Salvucci says. """That's all we give her."""\n\nMeat nods. Her footsteps (and screams) trail away.\n\nAfter three minutes, Salvucci says """She's had enough time. Let's go."""\n\nThe three of you run down the hall to sickbay. She's inside, screwing a hose into a black machine in the corner of the room. She looks up. """I told you to give me mor--"""\n\nShe's interrupted by Markie's descent from the ventilation shaft onto the examination table. She growls at all of you. A giant purple claw has sprouted out of her missing arm. The other arm is rotting, like the rest of her body.\n\n"""Prettyprettyprettypretty."""\n\nOut of the corner of your eye, you see the cauterizing saw on the table next to the bed. \n\n1. [[Use the saw.]]\n2. [[Use your gun.]]\n\n"
"StoryAuthor","Javy Gwaltney "
"“You’re welcome.”","Meat lights the rag and then tosses the bottle at the corpses. Ben goes up in flames quickly. The captain isn’t far behind.\n\n“Come on, let’s go,” Neil says.\n\n“Yes,” Strauss says. “Anywhere but here.”\n\n“Sure you don’t want to watch your boyfriend barbecue?”\n\nStrauss gives him a look of pure malice and then walks around the corner.\n\nNeil waits until she’s out of sight. “What now?”\n\nMeat looks at him. “We’re not done hunting.”\n\n“Did either of you get the captain’s pistol?”\n\n“Yeah, it didn’t have any ammo in it, though. That’s not good. Man is…was a crackshot. That thing probably soaked up all those bullets like a sponge.”\n\n“We’ll have to improvise.”\n\nThe three of you leave. You don’t look back at the bodies, but you can hear the flesh crackling.\n\nStrauss is waiting for you down the hallway, arms folded, the stony quality of her face fully returned. “What now?” she says.\n\n“We find the other one and kill it.”\n\n“Yes, but how, precisely? What’s our strategy?”\n\n1.[[“We need someone in the air ducts.”]]\n\n"
"""Why the long face, cap?""",""""Those three people were under my command. Their lives were in my hands. At the very least I made a decision that cost that boy his life. He wasn’t even twenty years old yet.”\n\nYou hear his voice break.\n\n1.[["""I would have made the same choice."""]]\n2.[["""Bear the weight later. There are still lives in danger here."""]]"
"""God damn it.""",""""Listen, I know this sucks but look at it this way: you get a cool robo foot now! And some fingers too! And we're all gonna get citations after this at the very least."""\n\n1.[["""Except for the dead."""]]\n2.[["""I better get a lot more than a citation for my goddamn foot."""]]\n"
"Let Salvucci kill you.","Salvucci pulls out pistol and puts a round through Neil's forehead.\n\nYou close your eyes as he points the gun at you. You never open them again.\n\nThe End\n"
"Opt to go home.",""""Right. I understand.""" She doesn't meet your eyes.\n\nThe cabbie drops you off first at your home in the suburbs.\n\n"""Julia,""" Strauss says as you get out of the car. """Take care, okay?"""\n\n1. [["""Thanks, doc."""]]\n2. [["""I will."""]]"
"Space that motherfucker.",""""Hanger it is then,""" Meat says.\n\n"""One of us needs to lead it there,""" Strauss says. """Play wounded. Beg for help. The others have to hang back otherwise it won't fall for the trick."""\n\n"""I don't like this,""" Salvucci says.\n\n"""Me neither, but she ain't wrong,""" Meat says grimly. """Somebody's got to be ready to put it all on the line for this."""\n\n"""I'll go,""" Strauss says.\n\nMeat can't hide his shock. """What?"""\n\n"""I think we've already established I'm pretty helpless, which means that thing has too. It'll come running."""\n\n"""This is fucking crazy. Cap, we can't send her out there.I'll go,""" Meat says.\n\n"""You're the biggest of us. It won't go after you, not until it's killed everyone else off. It has to be me."""\n\nSalvucci furrows his brow. He unholsters his pistol and hands it to Strauss. """I want my gun back, doctor. Be careful."""\n\n"""Yes sir."""\n\n"""Five minutes and then we're coming after you,""" Meat says.\n\nShe nods.\n\n1.[["""You finally turn out to be useful."""]]\n2.[["""Don't let it eat you."""]]"
"Tic-Tac-Toe","Neil grabs a tablet from the counter and opens the Tic-Tac-Toe program that comes installed on every device by that developer. You play seven times and tie each time.\n\n"""This game is pretty dumb,""" he says.\n\nYou’re about to start the eighth round when the second door to sickbay opens, and Meat and Salvucci step inside; both men wear dark expressions.\n\n“I’m guessing your hunt was uneventful?” Strauss says.\n\n“Yeah, go on and rub it then,” Meat says, turning to rifle through the medical cabinets.\n\n“What are you looking for?”\n\n“Food.”\n\n“This is a medical facility. What makes you think there’s food in here?”\n\nMeat opens one of the lower cabinets and, after a moment, pulls out a large bag of apricot chips.\n\n“Your assistant told me about his stash a while back.”\n\n“I’m glad you can eat his food while his blood is smeared all over the floor."""\n\n“Not like he’s going to need them,” Meat says with a shrug.\n\n“Enough you two,” Salvucci barks. “Pilot, you all right?”\n\n“Yeah, I’m fine, captain. Thanks for asking.”\n\n“Did you three see anything?”\n\n“No,” Strauss says.\n\n1.\t[[“Where did you look?”]]\n2.\t[[“Did it leave any sort of trail?”]]"
"“Yeah, I got it.”","“Good. Give me your gun and turn the gas on before you leave.”\n\n“There’s no way out except through the front.”\n\n“Vent,” he says, pointing at a vent near one of the stoves. “…Gotta crawl fast. I’ll give you as much time as I can.”\n\nA clanging at the door. Whatever was inside Markie, was now trying to get in the kitchen.\n\n“This ain’t fucking right, man. It’s not right at all.”\n\n“Just give me your damn gun, dude.” He coughs. Meat, with reluctance, takes the pistol from his holster and sticks it in Neil’s hand. \n\nStrauss quickly turns on all the gas stoves in the room.\n\nAnother bang at the door. The tip of a tentacle pierces the door and writhes wildly about, slapping a nearby wall.\n\n“Go,” Neil says, fighting to stay conscious.\n\n1.[[“I’m sorry.”]]\n2. [[Leave.]]\n"
"""No, he didn't.""","Shit. We can't set this to autopilot or send out a distress beacon without access to that console."""\n\n"""What's the trouble, cap?""" Meat says, stepping through the door.\n\n"""Neil had a password. Do you know it?"""\n\nMeat shakes his head.\n\n"""Okay, what did we know about him?"""\n\n"""He liked video games,""" Meat offers, approaching the console.\nSalvucci slowly inputs """FLAPPY BIRD XXXXXXI."""\n\nACCESS DENIED, the screen reads.\n\n"""Worth a shot."""\n\nYou all spend an hour typing various game titles, but none of them work. Eventually you give up and retire to the mess hall where Salvucci cooks steak for you both. Both men sit away from you when it's time to eat.\n\nYou eat quietly.\n\nThe next day you all try again with various game titles to no avail. \n\n"""To think everything hinges on a goddamn video game,""" Meat says.\n\nFor days it goes like this, your ship still drifting in space. Eventually you run out of food. You all try for hours in desperation to magically conjure up the password, but it's no good. The three of you realize that at that point you're just making up titles that sound like video games: Masher Nasher, The Adventures of Wallaby Dingo.\n\nYou all make your way to the mess hall and sit quietly, removed from one another. You think of your home back on Mars. You're glad you didn't get a pet. You wonder if anyone besides your parents will mourn your passing. Will they ever even know? You stare out one of the hall's viewports into space, you grave. There are worse ways to die, you say to yourself, than floating among the stars. \n\nIt's hardly a comfort for you in the days to come. \n\nOne day, Salvucci takes his life, a gunshot ringing out on the far side of the ship, away from the mess hall, away from you and Meat.\n\n"""You know,""" Meat tells you a week later. """I thought about eating you."""\n\n1.[["""Why did you decide not to?"""]]\n"
"Panic and run.","Meat fires the rifle across the room, the gun’s light chasing Markie’s feet as she darts away. You make a run for where you think the door is. Behind you, Neil screams in terror.\n\nYou hear the tell-tell click of the rifle as the clip goes dry. Meat swings the rifle around to point the flashlight at the door.\n“Go!”\n\nIn the dark, you find the handle and yank on it. Light bleeds into the darkness, as all three of you sprint into the hallway. You slam the door and then bend over to catch your breath. Luckily, you manage to pull back just in time to avoid the spew of vomit that erupts from Neil’s mouth.\n\n“That was Markie—our Markie?” he says, wiping the spittle from his lip.\n\n“Yeah, it was,” Meat answers, a tinge of sadness in his voice. He reloads the clip. “This is my last one.”\n\n“Why didn’t she attack us?”\n\n1.\t[[“She wants us to run out of resources.”]]\n2.\t[[“She’s toying with us.”]]\n\n"
