incoming,text
"Save yourself; leave him to die.","It's a hard choice, but in the end, you get to your feet and sprint past the monster as it slaughters Meat. You can hear his screams as you run down the hall. Soon things are mercifully silent. \n\nYou climb up into the ventilation and decide to make your base of operations there. You're a survivor, you tell yourself. All you have to do is stay alive two months. That's all.\n\nYou go, day by day, into the ship in search of supplies. You often go to the mess hall to stock up on food and bring it back to the vents. You run into creature twice. Each time it's grown bigger, nastier. The first time, you get away without a scratch.\n\nThe second time, a tentacle pierces your ankle. You still manage to hop away, but you can't climb into the vent because of your injury. You seek refuge in the darkness of the barracks. Soon every breath brings pain. You refuse to accept the hand you've been dealt, even when Strauss, a bullet hole in her forehead, sits down beside you to have a chat.\n\n""You had a good run, idiot,"" she says. \n\n1.[[""You aren't real.""]]"
"""Yeah, no, fuck that.""","Markie slaps your arm. ""Don't be such a pussy, Zoe.""\n\nShe turns to the others.""Ryan, let Captain Salvucci know what we've found. Let's try and get a pick-up at the LZ in two hours.""\n\n""Aye.""\n\n""That thing loaded, Meat?""\n\n""Duh.""\n\n""Okay, I'm thinking we should split up to cover more ground. How should do this?""\n\n1. [[Pair off with Ryan.]]\n2. [[Pair off with Markie.]]\n3. [[Pair off with Meat.]]\n"
"""Grow some balls and ask her yourself.""","""Ouch! Yeah, you're right. Sorry. Dumb question,"" he says sheepishly. ""Kind of awkward to put you in that position anyway. I was just—""\n\nA blur of blue darts across your light. You raise your pistol. Ryan looks over his back and then at you.\n\n""What is it?""\n\n1.[[""I saw something.""]]\n2.[[""Get out of the way.""]]\n3.[[""MOVE!""]]\n\n"
"Get out of there.","You both retreat. ""Neil,"" he yells into the comm. ""Bring the Speedwell to the LZ. We need some fucking help here.""\n\n""Coming as fast I can,"" you hear Neil say.\n\nYou run and run and run. You lose feeling in your legs but somehow keep going full speed anyway. Near the end, you swear that your heart is going to burst and that your lungs will catch on fire, but you manage to stumble out of the tunnel into the irradiated light of dusk.\n\nAcross the way, you see Markie running by herself--her suit covered in what appears to be blood. Ryan is nowhere to be seen. You've covered half the distance to her when, looking up, you see the Speedwell beginning its descent.\n\nWhen you reach her, you take her by the arm and look through her visor. Her eyes are wild, and she's sweating.\n\n""Markie,"" Meat says, ""where's Ryan?""\n\nShe stutters. ""D...d..dead.""\n\n""Fuck!"" He turns back to the hole you and he emerged from. The wave of crabs has reached the mouth of the cave. In the light, they're purple and fungal looking.\n\nHe fires some shots at them while you tend to Markie. Her arm is wounded.\n\n1.[[""You alright?""]]\n2.[[Stay silent and keep your hand over the tear in her suit.]]"
"You go to the mess hall for a bite to eat.","The mess hall is rather small: two tables next to an enclosed kitchen. You find Meat sitting by himself, shoveling ramen into his mouth. A plastic cup filled with cheap whiskey is next to his arm. You grab your favorite snack, a box of soy oatmeal cookies, and take a seat.\n\nMeat looks up at you, eyes red, a weary expression.\n\n""Hell of a day, huh? Poor Ryan. How's Markie?""\n\n1.[[""Strauss is removing her arm.""]]\n2.[[""Not great.""]]\n\n\n"
"""He didn't.""","""Shit. We can't set this to autopilot or send out a distress beacon without access to that console.""\n\n""What's the trouble, cap?"" Meat says, stepping through the door.\n\n""Neil had a password. Do you know it?""\n\nMeat shakes his head.\n\n""Okay, what did we know about him?""\n\n""He liked video games,"" Meat offers, approaching the console.\n\nSalvucci slowly inputs ""FLAPPY BIRD XXXXXI.""\n\nACCESS DENIED, the screen reads.\n\n""Worth a shot.""\n\nYou all spend an hour typing various game titles, but none of them work. Eventually you give up and retire to the mess hall where Salvucci cooks hamburger meat for you both. \n\nYou eat quietly.\n\nThe next day you all try again with various game titles to no avail. \n\n""To think everything hinges on a goddamn video game,"" Meat says.\n\nFor days it goes like this, your ship still drifting in space. Eventually you run out of food. You all try for hours in desperation to magically conjure up the password, but it's no good. The three of you realize that at that point you're just making up titles that sound like video games: Masher Nasher, The Adventures of Wallaby Dingo.\n\nYou all make your way to the mess hall and sit quietly, removed from one another. You think of your home back on Mars. You're glad you didn't get a pet. You wonder if anyone besides your parents will mourn your passing. Will they ever even know? You stare out one of the hall's viewports into space, your grave. There are worse ways to die, you say to yourself, than floating among the stars. \n\nIt's hardly a comfort for you in the days to come. Eventually Salvucci takes his life, a gunshot ringing out on the far side of the ship, away from the mess hall, away from you and Meat.\n\n""You know,"" Meat says one day. ""I thought about eating you.""\n\n1.[[""Why didn't you?""]]\n2.[[""Not much to eat.""]]\n"
"Keep on going toward the mess hall.","""See,"" Meat says. ""Zoe says he'll be fine too. He's a big boy.""\n\nThe four of you make your way to the mess hall. \n\n""Check everything,"" Salvucci orders. You look around the tables and near the entertainment closest while Meat looks around the kitchen. Salvucci keeps his eyes on the door. Strauss sits at a table away from everyone.\n\nYou find a small bag of chips and pocket them. No monsters, though.\n\nMeat pokes his head out of the kitchen. ""Nothing."" He looks at all of you and shrugs his shoulders. ""What now?""\n\nAs if to answer him, a loud shriek erupts from the vent hanging over you all.\n\n""A GIFFTTTTT,"" Markie screams from the vent.\n\n""Oh god,"" Strauss says, backing into the wall.\n\n""Kill it,"" Salvucci says, raising his pistol. You, Meat, and Salvucci fire into the vent.\n\n""Don't waste your ammo. Just a few shots,"" Meat yells.\n\nYou fire half of your clip and lower your weapon. The vent cover drops to the floor. Meat and Salvucci lower their guns as well.\n\n""We got her, right?"" Meat says.\n\n""agiftagiftagiftagift,"" Markie answers from the vent.\n\n""Fuck me.""\n\n""agiftagiftagiftAGIFTAGIFTAGIFT,"" she screams. At first, you're not sure what falls from the vent.You see a small, almost circular object dropping through the air. When it hits the ground with a splat, you know what it is, but you can't bring yourself to look.\n\nStrauss' screams confirm your fears. You finally look down; it's Neil's head. Both his eyes have been gouged out and there's a jagged line of flesh and muscle where he was decapitated.\n\n""A GIFT!"" Markie yells once more before you hear her scamper away further into the ducts.\n\n""I told you,"" Strauss, the first to speak, says. ""We should have sent someone to look after him.\n\nMeat kicks over a table.\n\n""I told you!"" Strauss screams at him.\n\n""Doctor, quiet,"" Salvucci barks. He lowers his voice. ""We'll mourn later.""\n\n""If we fucking live that long,"" Meat says.\n\n""We have to trap it,"" Strauss says suddenly.\n\n""Go on, doctor,"" says Salvucci, still eyeing Neil's head.\n\n""I think it's pretty clear bullets aren't effective. We need to either space her or trap her in a tightly contained space and burn her.""\n\n""Risky options,"" Salvucci says.\n\n""For once, I'm in agreement with the good doctor. This thing is shrugging off bullets like their bug bites. Question is: burn it or space it?""\n\n1. [[Burn that motherfucker.]]\n2. [[Space that motherfucker.]]"
"""Yeah? Well, let's make it fucking count.""","He doesn't meet your eyes. ""Whatever. We need...we need to get this boat moving again. He gave you a password, right? Let's hope that console has autopilot or some shit. Worry about that motherfucker then.""\n\nThe two of you make your way toward the cockpit.\n\nA few minutes later you reach the cockpit door. Ben's body is still there, as are the burnt remains of the captain.\n""Well, that's good, all things considered,"" says Meat. You step into the cockpit. The door slides shut behind you.\n\n""Here's the computer.""\n\nYou step over to the main console. A password screen greets you. You type in ""KONAMI.""\n\nThe screen changes to a selection of menus.\n\n""Here we go: autopilot"" says Meat. He touches the screen and selects NEW AUSTIN. You head for the door.\n\n""All right, good. We're set. Let's get the hell out of her--""\nA tentacle sweeps through the door as soon as it opens and brushes both of you aside with a mighty swing. \n\nYou slam into the viewport, cracking the glass, and then fall to the floor. Looking up, you see the thing step into view: it's monstrous, with a muscular human abdomen. The thing's face is distinctly unhuman with countless, slitted eyes glaring at you. The monster's mouth is a vortex of meat and sharp teeth. Four tentacles protrude from its back, each one moving like a rattle snake.\n\nYou turn to look at Meat. He's being lifted into the air by one of the tentacles. His face turns red; he's slowly being choked to death.\n\nYou reach for your pistol.\n\n1. [[Save Meat's life.]]\n2. [[Save yourself; leave him to die.]]"
"""Roger that.""","Each group goes in a separate direction; you hike down the cliff with Ryan. It takes the larger portion of an hour to reach your tunnel. You step inside.\n\n""Flashlights,"" Ryan says. \n\nYou tell the computer to turn on the light attachment in your suit. It flickers for a moment before shooting a cone of light from your chest compartment.\n\n""Let's do this,"" he says, pulling out his pistol.\n\nThe two of you proceed through the cave. On the Head-Up Display (HUD) of your suit, you can see the heartbeat monitors of everyone in your squad. You see that yours is going a little faster than normal and, knowing that everyone else can see that as well, you feel a little embarrassed.\n\n""Ten bucks we find caveman drawings.""\n\n1.[[""Deal.""]]\n"
"StoryTitle","The Terror Aboard The Speedwell"
"""She was infected.""","The man seems doubtful of your lie, but he has no evidence to contradict it.\n\nWithin three days, you're free to leave the military base. \n\nYou return to your home in the suburbs and pour yourself a drink from the unopened bottle of whiskey in your cabinet. In spite of recent events, you feel...good. \n\nNot only did you survive horrific setup ripped from a bad horror movie...you killed someone and got away it. You feel a buzz.\n\nYou got away with murder.\n\nAnd thus begins your reign as Mars' most renowned serial killer. Drunks staggering away from the bar and the homeless are your victims. Your weapon of choice? A scalpel. Each kill fills you with a kind of energy you've never known. The news says you're doing it because you're religious or you play video games or you have sexual fantasies about your mother.\n\nYou have no delusions. You just like killing people. \n\nThe cops finally get you on the sixteenth murder. Turns out the poor bum you stabbed was undercover. You see the flash of red and blue as soon as you penetrate the poor officer's throat. You run, not even bothering to retrieve the scalpel jutting from his trachea.\n\nYou don't get very far. The sniper's bullet shatters your sternum, sending bone fragments into your heart. You're already dying when you hit the ground.\n\nAs police officers gather to get a good look at you, all you can do is wonder what they'll say about you on the morning news.\n\nThe End\n"
"Say nothing and leave.","You hear him call your name as you turn and sprint down the hall.\n\nFool, it says. I offered you evolution, wretch.\n\nBlood drips from your nose. There's a pain in your stomach. You have to hurry.\n\nYou reach the hanger within a minute and seal the door behind you. \n\nYou approach the hanger door and place your hand over the release button. Your legs go numb and you fall to the floor, hand still held against the button. You press it and close your eyes. There's a whoosing sound as air is sucked past you, stinging your cheeks.\n\nThe first thing you feel is the cold. You open your eyes to see the Speedwell in all its glory as you drift away. The thing in your brain screams in anger and despair, but another voice cuts through. ""Just let go,"" Markie says, her voice free of malice and madness.\n\nYou turn away from your ship and peer out across the ocean of stars to gaze at what you think is the sun in the far distance. It's quite pleasant from afar.\n\nYou take her advice.\n\nThe End\n\n"
"""It's pretty funny, you saying that, when you were ready to pull her down a couple of hours ago. Just sayin'""","You see hurt flash across Strauss' eyes.\n\n""Zoe,"" Salvucci says sharply.\n\n""No, it's okay,"" Strauss says. ""They were friends, except your friend's dead, Zoe. That thing out there isn't Markie anymore. I just hope you realize that and don't get us killed,"" she says turning away from you.\n\nThe two of them descend into uncomfortable silence; Strauss looking at her feet, Salvucci at the viewport. You feel awkward standing there, so you wander away.\n\n1.[[Take a nap.]]"
"""Suck it up, Neil. Cry later.""","He doesn't seem to hear your harsh comment. ""Fuck. Guys, I have to tell his parents.""\n\n""Worry about that later,"" says Salvucci. ""Right now we need to—""\n\nThe alarm wails through the halls. Salvucci turns to Meat. What's left of the color in Meat's face drains as he gazes at the control panel.\n\n""Contamination in sickbay. Quarantine square's been broken.""\n\n""What's going on?""\n\nSalvucci is quick. ""Neil, you stay here. We'll lock you in so you're protected. You two come with me. Arm yourselves.""\n\nMeat grabs his rifle, and the three of you are out of the cockpit. Right before the metallic door slides shut, you hear Neil say ""protected from what?""\n\n1. [[Head to sickbay.]]"
"Refrain from doing anything.","""Fuck. Guys, I have to tell his parents.""\n\n""Worry about that later,"" says Salvucci. ""Right now we need to—""\n\nThe alarm wails through the halls. Salvucci turns to Meat. What's left of the color in Meat's face drains as he gazes at the control panel.\n\n""Contamination in sickbay. Quarantine square's been broken.""\n\n""What's going on?""\n\nSalvucci is quick. ""Neil, you stay here. We'll lock you in so you're protected. You two come with me. Arm yourselves.""\n\nMeat grabs his rifle, and the three of you are out of the cockpit. Right before the door slides shut, you hear Neil say ""protected from what?""\n\n1. [[Go to sickbay.]]"
"""We did our best.""","He sighs. ""I want to believe you, but...nevermind. What now?""\n\n1.[[""We sleep.""]]"
"""It ain't your fault.""","""They're all dead because of me,"" he says quietly. ""I've never had people die under my command before. It's a strange feeling.""\n\n1.[[""Ben isn't on you.""]]\n2.[[""Let it go. I need you here and focused. We all do.""]]"
"Let ‘em burn.","You follow Salvucci as he leaves the room. Before you step out you turn to Meat. His face is pale.\n\n1.[[""Good luck.""]]\n2.[[""Be careful.""]]\n3.[[""You sick fuck.""]]\n"
"Run. Now.","You fire several shots into the sea of creatures and even kill a few, but they still surge toward you.\n\n""What are you doing? Run!""\n\nYou both retreat. ""Neil,"" Meat yells over the comm. ""Bring the Speedwell to the LZ. We need some fucking help here.""\n\n""Coming as fast I can,"" you hear Neil say.\n\nYou run and run and run. You surge ahead of Markie and lose feeling in your legs, but somehow you keep going full speed anyway. Near the end, you swear that your heart is going to burst and that your lungs will catch on fire, but eventually you stumble out of the tunnel into the irradiated light of dusk.\n\nAcross the way, you see Meat running. Ryan is nowhere to be found. You've covered half the distance to Meat when, looking up, you see the Speedwell beginning its descent.\n\nYou're almost to him when you hear Markie scream. Turning, you watch her fling one of the crab creatures across the ground.\n\n""Fuck!"" she yells.\n\nMeat blasts the creature into pieces.The two of you rush over to her. She's holding her arm.\n\n""It got me,"" she says; you detect fear in her voice. She turns to Meat.\n\n""Where's Ryan?""\n\n""Goddamn fucking thing ate him. It ATE him.""\n\nMeat's answer fills you with dread. No one that close to you has ever died before. Your vision becomes unfocused. A slap on the arm brings you back.\n\n""We've got company, Zoe. I need you here and now,"" Meat says, nodding at the mouth of the cave where the crab creatures are gathering. There must be thousands of them. Luckily, behind you, you hear the Speedwell land.\n\nMeat fires several shots at the crabs, but they don't seem to be leaving the cave anyway.\n\nYou and Meat help Markie to the ship's elevator. Meat enters a combination on the keypad and the door slides open. Inside the elevator, as you ride up, all three of you remove your helmets. You notice for the first time that your face is drenched in sweat.\n\nA ding. The door opens. Captain Jonas Salvucci, an older, muscular man with little patience of tomfoolery, awaits you—-his hand wrapped around the pistol in his holster. He takes his hand away from the gun when he sees there's no threat.\n\n""Get her to sickbay.""\n\nYou nod and help Markie through the hallway of the ship. Behind you, you can hear Salvucci interrogating Meat.\n\n""What happened to Ryan?""\n\n""He's dead, cap. Something got him.""\n\n""Hell, Travis. What did you find down there?""\n\nWhen you get to sickbay, both Lenore Strauss, the doctor, and her geeky assistant Ben are prepping the examination table.\n\n""Where's she wounded?"" Lenore asks, as you help a woozy Markie out of her suit. You glare at Ben as he gawks at her well-toned body. He smiles sheepishly and looks away, cheeks burning red with shame. Markie's drenched in sweat; she stares around wildly while Lenore straps her in. She examines the bite: it's just above the elbow, an inflamed bulging of the skin.\n\n""And I was young and we were running,"" Markie rambles, ""eyes bouncing up and down the shore while the sun cooked the corpses of washed up jellyfish.""\n\nYou turn to Lenore, who's prepping some kind of tool.\n\n1.[[""What the hell is she saying?""]]"
"""I'm fine. Stop asking.""","He looks away sheepishly. ""Sorry.""\n\n""Stop trying to hit that, Ryan. It's not gonna happen,"" says Markie, the Speedwell's science officer.\n\nRyan waves his hands dismissively. The enforcer of the group, Meat, chuckles. ""She told you.""\n\n1. [[Wink at Markie in appreciation.]]"
"""Move past it or more people are going to die.""","He nods. ""You're right. Need to focus on the task at hand. What do you think it is you found on earth?""  \n\n1.[[""Cthulhu?""]]\n2.[[""No clue.""]]\n"
"Eat him.","You take your knife and slowly cut up Meat's body. It's messy work, dividing the flesh and muscle from the bone. You store the body in various bags that are then stuffed into the freezer.\n\nYou stay alive another week, but the ships never come. The will to live finally leaves you; you lay down on the floor and close your eyes. You would cry if you had the strength.\n\nThe last thing you feel is the cold of the metal floor leaving your cheek.\n\nThe End\n\n"
"""It was tempting.""","""Right? She's awful. No doubt about it.""\n\nThe two of you enter the cafeteria and then, after taking a precautionary look around, you go into the kitchen and begin to stuff everything you can get your hands on into the two bags you brought from sickbay: fruit chips, soda, water bottles, pastries, canned soup.\n\nWhen you've filled the bags, you leave the cafeteria and make your way to the common room. Strauss, Neil, and Salvucci are waiting. The common room is a circular room with a couch, several chairs, and a large wall-mounted monitor connected a server archive of countless movies, shows, and documentaries.  \n\nOn the back wall, there are portholes—just like on the ships of old that sailed the waters—where you can gaze into the dark of space.\n\n""Run into any trouble?"" Salvucci asks as you hand him the bag.\n\n""Didn't see a damn thing,"" Meat says.\n\n""I'm telling you,"" Strauss says, rubbing her bandaged arm, ""we won't see it until it wants us to see it.""\n\nMeat grumbles something about paranoia and then heads over to the table, where Neil is setting up a checkers board.\n\n""How's your arm, doctor?"" Salvucci asks.\n\n""Fine, captain. Thank you.""\n\nYou feel tired.\n\nWhat should you do?\n\n1. [[Talk to Meat and Neil]]\n2. [[Go to sleep.]]\n"
"""Nothing to be done about it, I guess.""","He shrugs his shoulders. ""I guess so.""\n\nYou both return to your group of friends to find that Neil is mooning the barkeep.\n\nWeeks pass. One day you see a report about Earth destructing. ""An issue with the core,"" says the handsome anchor. No one mentions monsters. No mentions nukes or fleets of war crusiers. It stirkes you that no one will ever know the sacrifices of you or your crew. You weep and Jessica asks what's wrong.\n\nYou lie. Just as you do when she asks you about the augmentations--the very ones she installed. ""Accident in the cryotube,"" you tell her. You're so wracked with guilt over these lies that you make it a priority to never lie to her about anything. For the most part, your relationship is one built on trust.\n\nThree years after your return to Mars you're married. It's a simple ceremony. Your parents show up, as do the surviving members of your crew. You eat cake. You kiss.\n\nYou move in with Jessica even though her apartment is smaller than yours. You just love the view of the Martian landscape and Jessica, quite content not to move anything, is more than happy to oblige you.\n\nOne day you catch a glimpse of light reflecting off the glass window of the balcony. You step onto the balcony and look out across the red canyons of your planet just to take in the beauty of it all. This is your new life, you tell youself. You've earned every second of it.\n             \nThe End\n\n"
"""I'm so sorry, Neil.""","You make your way to the vent where Meat has just finished prying off the cover. The gas is thick in the air, making you slightly dizzy.\n\n""Tight fit,"" he says. ""I'll go first so I can remove the next cover.""\n\nYou look back to see that multiple tentacles have penetrated the door. Neil is pointing the pistol in the air and is breathing hard.\n\nYou force down the feeling of despair in your stomach and crawl through the vent. When you catch up to Meat, he's already kicking a cover.\n\n""Almost got it!"" With one last kick, the cover comes free. You emerge into the hallway just in time to feel the ship shake violently.\n\nMeat slams his fist into the wall over and over. \n\n1. [[Put your hand on his shoulder.]]\n2. [[Don't.]]"
"""It doesn't at all.""","""Right?  What a horrible thing to do.""\n\nYou both return to your group of friends to find that Neil is mooning the barkeep.\n\nWeeks pass. One day you see a report about Earth mysteriously self-destructing .""An issue with the core,""  says the handsome anchor. No one mentions monsters. No mentions of nukes or fleets of war crusiers. It stirkes you that no one will ever know the sacrifices of you or your crew. You weep and Michelle asks what's wrong.\n\nYou lie. Just as you do when she asks you about the augmentations. Accident in the cryotube, you tell her. You're so wracked with guilt over these lies that you make it a priority to never lie to her about anything else. For the most part, your relationship is one built on trust.\n\nThree years after your return to Mars you're married. It's a simple ceremony. Your parents show up, as do the surviving members of your crew. You eat cake. You kiss.\n\nMichelle moves in with you. You live a comfortable life together. She starts talking about children and you make efforts to put off that conversation for as long as possible.\n\nOne day, the two of you take a trip to the recently terraformed beach. There's a moment where you're looking out across the manufactured ocean of Mars, wondering what lies ahead for you.\n\nYou know the ocean is fake, but you can't help but admire its beauty. This is your new life, you tell youself. It's one you've made for yourself, and you've earned every second of it.\n             \nThe End\n\n"
