incoming,text
"""You only did what you had to.""","""I guess so. Still. I wish things could have been different.""\n\nYou sip your drinks without another word until it's time to go. The cabbie takes you home first.\n\n""Julia,"" Strauss says. ""Take care, okay?""\n\n1. [[""Thanks, doc.""]]\n2. [[""I will.""]]"
"""I didn't.""","""If it’s not dead, we’re fucked. All we got left is your pistol. I’m guessing you’re down to two clips.""\n\nYou pop the clip out of your pistol to show him it’s the last one.\n\n""Shit.""\n\n""We don’t know if it’s alive. If it is, we’ll improvise.""\n\n""Great, I wonder who’ll die next time thanks to our masterful improvisation abilities.""\n\nStrauss says nothing. \n\nA few minutes later you reach the cockpit door. Ben’s body is still there, as are the burnt remains of the captain.\n\n""Well, that’s good, all things considered,"" says Meat. You notice that Strauss is deliberately looking away from Ben’s smashed skull.\n\nThe three of you step into the cockpit. You slam the door behind you.\n\n""Here’s the computer.""\n\nYou step over to the main console. A password screen greets you. You type in ""KONAMI.""\n\nThe screen changes to a selection of menus.\n\n""There’s the autopilot,"" says Strauss. She touches the screen and selects NEW AUSTIN.""\n\n""We done?"" Meat asks.\n\n""Yeah, I think we’re set.""\n\n""Good.""\n\nAll of you approach the door.\n\n""Now let’s get out of here before that fucking thing corn—"" \n\nA tentacle sweeps through the door as soon as it opens and brushes all of you aside with a mighty swing. You all going flying across the room. You slam into the viewport, cracking the glass, and then fall to the floor. Looking up, you see the thing step into view: it’s monstrous, with a muscular human abdomen. \n\nThe monster's face is distinctly unhuman with countless slitted eyes glaring at you. The monster’s mouth is a vortex of meat and sharp teeth. Four tentacles protrude from its back, each one moving like a rattlesnake.\n\n""No!"" you hear Strauss scream as one of the tentacles darts out and wraps itself around her neck.  It lifts her into the air and pulls her toward its master. You turn to look at Meat who’s paralyzed with fear, watching one of the tentacles dance above him.\n\nYou reach for your pistol.\n\n1. [[Save Meat.]]\n2. [[Save Strauss.]]\n3. [[Save yourself.]]\n"
"Draw it out.","""Okay, with what?"" Neil asks.\n\nThere’s a moment of silence as you, Meat, and Strauss turn to look at Neil. \n\n""Oh,"" he says, getting it. ""Well fuck that.""\n\n1.[[""Don’t be a baby.""]]\n2.[[""We could just knock you out.""]]\n\n\n"
"""Something happened, huh?""","""The infection spread,"" Strauss explains.\n\n""What fucking infection?"" Meat interjects.\n\nStrauss turns her cold gaze onto him. ""I don’t know precisely what is in her body, Travis. What I do know is that once I amputated her arm, it lunged at my throat.""\n\n""Bullshit.""\n\n""No, it’s…it’s…true,"" Ben stammers. ""It’s over there. Look.""\n\nThere, lying on the ground, is an arm with shriveled fingers caked in yellow ooze. You can barely make out three bullet holes.\n\n""Lenore says that Ben saved her life by putting it down,"" Salvucci explains.\n\n1.[[""What about Markie?""]]\n2.[[""Nice job, shrimp. Didn't think you had it in you.""]]"
"""Nobody could have predicted that.""","He doesn't meet your eyes and offers no reply.\n\n""He gave you a password, right?"" Strauss says. ""Maybe there’s an autopilot sequence on his computer.""\n\n""Doesn’t do us any good if that thing is still stomping around.""\n\n""Do you really think it survived that blast?""\n\n""Is that a serious question?""\n\n""Either way, we need to get the ship moving. Let’s get to the cockpit and decide what to do there.""\n\nYou make your way toward the cockpit. About halfway there, Meat speaks. ""What was it doing when it killed Neil?""\n\n""Evolving,"" Strauss answers.\n\n""Did you get a good look at it?"" Meat asks.\n\n1.[[""I didn't.""]]\n2.[[""It had a lot of tentacles.""]]\n"
"Shoot Markie.","""Here’s what we’re going to do,"" Salvucci starts. \n\nThe sudden discharge of your pistol cuts him off. The first two rounds shatter the quarantine glass. You approach the cube. \n\nSomeone—Meat perhaps?—is shouting something, but it’s too late. You're raising your gun, leveling it at Markie’s head. She looks up at you, uncomprehending.\n\nYou fire once. A mixture of red and yellow liquid spills out of the back of her head as her body crumples. The smell is excruciating. You gag. And that’s when Meat smashes the butt of his rifle into your face.\n\nYou black out.\n\nYou wake up two months later in a prison cell where Salvucci, with a mixture of sympathy and disgust hiding behind his blue eyes, explains how they put you in cryo sleep for the rest of the journey home and how now you will be brought before a military tribunal for the murder of your crewmember.\n\nHe refuses to listen when you try to explain your actions and offers you only one comfort before leaving: he hears your lawyer is pretty damn good.\n\nAnd she is. She’s a looker and has a brain to match. She manages to convince the court that you committed, not murder, but manslaughter out of concern for your crew. You serve five years at Titan penitentiary and earn the good will of the prisoner population by teaching them science and mathematics, and regaling them with stories of your travels.\n\nUpon release, you can’t find a job teaching at any of the universities on Mars or even the terraformed moons. Finally, a desperate temp agency takes a chance on you and you end up working as a secretary for an accounting office in New Memphis. They eventually hire you full-time and, despite being miserable, you never look for another job out of fear of rejection.\n\nEventually you get lonely and give Meat a call, hoping to reconcile. He’s not there. You leave a message, but he never calls back. You have night terrors and imagine Markie’s face, her yellow eyes, staring at you from the darkness. \n\nWhen you were younger, you told yourself you’d never be a cat lady, so you become a lizard lady instead. Most of your free time and fun money are dedicated to purchasing and raising as many types of reptiles as possible. The chameleon Toro is your prized pet.\n\nFinally, some fifty years after you killed Markie, you begin to feel life slip away from you. You’re not sure if it’s disease or depression or some form of universal comeuppance, but you let yourself go piece by piece. However, you’re defiant all the way to the end. ""I did the right thing,"" you mutter to yourself. ""I saved lives."" \n\nSoon you fall into eternal rest. Your lizards are not far behind.\n\nThe End\n"
"""It might be Ben.""","""Even better,"" Meat says grimly.\n\n""Let’s just shut down the computer,"" Neil says.\n\n""It’s your computer. After you, your majesty.""\n\n""Oh no, you’ve got the gun. You go first. Please, I insist.""\n\nMeat grumbles as he steps past Neil and peers into the room. You see him flip on the light attached to the rifle.\n\n""See anything?""\n\n""No, but it’s dark. There’s shattered glass on the floor—probably the lights."" He creeps into the room slowly. \n\nYou and Neil follow.\n\nRemember me to the one who lives there…\n \nThe room is pitch black except for the light coming from the computer terminal next to Neil’s bed. The computer, a custom built powerhouse, sits on the floor and is connected to an obnoxiously large, wall-mounted flat screen. On the screen, you see a music library. Meat flashes his light across the floor. There’s at least 11 or 12 footsteps separating you and the terminal, a no-man’s land of shattered glass and possible traps.\n\n""Well,"" Neil says after a moment. ""I guess one of us should cross—""\n\nGunfire cuts off Neil’s sentence as Meat fires three rounds into the terminal. The music dies abruptly.\n\n""Are you fucking kidding me?!""  Neil erupts. ""That was two months worth of pay! It was like, the ultimate fucking entertainment system!""\n\nYou can’t make out Meat’s expression in the dark but you can tell he’s not in the mood to deal with Neil’s shit. ""Listen, if we get out of this alive, I’ll buy you a new toy, okay?""\n\n""It was brand new!""\n\n""Shut up. Did you hear that?""\n\nYou listen. You hear nothing, not the crackling of glass, or an insidious snicker. \n\n""Let’s go,"" says Meat. You all turn, and, of course, there she is, standing next to the door.\n\nNeil gasps in horror. Markie smiles at all of you, the hallway light shining on her face to reveal rotting flesh and a dangling eyeball. Her arm stump oozes yellow.\n\nMeat raises his rifle, but he’s too slow. She slams the door.\n\nYou’re locked in here with her.\n\n1. [[ Pull out your pistol and fire blindly.]]\n2. [[Panic and run.]]\n\n\n\n"
"""It's trying to scare us.""","""Well, we’re about to put an end to that shit,"" Meat says as you approach the crew’s quarters. You see large cables running through the doorway; they lead up the wall and into the ceiling.\n\nNeil reaches up and runs his hand along the cables. He quickly pulls it back. ""Augh! Fuck!""\n\n""What is it?"" Meat barks.\n\n""Nothing,"" Neil says, regaining his composure. ""Just fucking slime. Oh god, gag a maggot,"" he says. ""This shit reeks."" He holds his hand up to the light to reveal a goopy, transparent liquid.\n\n""Hey, that looks a little bit like—""\n\n""Don’t you say it, Travis.""\n\nYou examine the cables without touching them.\n\nMeat takes a look as well. ""Seems like a complicated operation.""\n\n""What, turning on the computer, starting a program, and plugging in some cables?""\n\nMeat turns. ""You didn’t see how feral this thing was—not to mention she’s missing a goddamn arm.""\n\n1.[[""Could be Ben.""]]\n"
"""Yeah. I understand.""","""Good. Give me your gun and turn the gas on before you leave.""\n\n""There’s no way out except through the front.""\n\n""Vent,"" he says, pointing at a vent near one of the stoves. ""…Gotta crawl fast. I’ll give you as much time as I can.""\n\nA clanging at the door. Whatever was inside Markie is now trying to get in the kitchen.\n\n""This ain’t fucking right, man. It’s not right at all.""\n\n""Just give me your damn gun, dude."" He coughs. Meat, with reluctance, takes the pistol from his holster and sticks it in Neil’s hand. \n\nStrauss quickly turns on all the gas stoves in the room.\n\nAnother bang at the door. The tip of a tentacle pierces the door and writhes wildly about, slapping a nearby wall.\n\n""Go,"" Neil says, fighting to stay conscious.\n\n1.[[""We fucked things up for you. I'm sorry.""]]\n2. [[Say nothing to him. Leave.]]"
"""Deal.""","""Seriously though, I wonder if we’ll find anything down here.  I still think it’s erosion. I mean, sure, these tunnels are uh pretty deep, I guess, but erosion can do that, right? Erosion. Yeah.""\n\nYou continue on, the darkness before you disappearing to reveal only more darkness. Your suit tells you that ten minutes have passed, but it feels like an age. Ryan’s chatter isn’t helping.\n\n""Hey, has Markie talked you about me at all? Actually, better question: do you know if she’s dating anyone? I mean, back on Mars.""\n\n1.\t[[""I don’t know.""]]\n2.\t[[""I don’t know, you fucking horndog.""]]\n3.\t[[""Grow some balls and ask her yourself.""]]\n"
"""I needed to ensure my survival. She was bait.""","Your confession damns you. You're court-martialed and found guilty of murder in the first degree. You're sentenced to life aboard Titan penitentiary.\n\nYou live within the walls of this fine establishment for 63 more years. You learn to live without dignity and eventually, after a decade of abuse from both your inmates and the guards, earn your own amount of respect. An inmate doesn't like the way you look at her. She attacks you. You break her neck by pushing her over a bannister. \n\nNo one messes with you anymore.\n\nYou spend the rest of your days caring for the community garden and reading literature in the library. No one comes to see you, which is fine. You've made it this far without people. You thrive in loneliness. At least, that's what you tell yourself to keep away the tears at night.\n\nOne morning your cellmate, Lucca, tries wake you up only to find that you aren't breathing. You're cold to the touch. ""She's dead,"" she yells at a nearby guard. ""This bitch is dead!""\n\nThe End\n"
"""Say what?""","""Blowing it to smithereens. Higher-ups decided it was already a dead husk of a planet anyway. A fleet's heading there now; they're gonna bombard it until it's nothing but dust. Can you imagine that? Where our ancestors came from...just gone? It doesn't feel right.""\n\n1.[[""It doesn't at all.""]]\n2.[[""Nothing we can do about it, Meat.""]]"
"""You finally turn out to be useful.""","She turns away from you and leaves the mess hall. You hear her break out into a run, her footsteps echoing through the hall.\n\n""Help!"" she shrieks as she runs. ""Help!""\n\n""Five minutes,"" Meat says, ""then we go after her.""\n\nTime passes painfully, slowly. Finally, Salvucci turns to both of you. ""We go. Now.""\n\nAll of you start running toward the hanger. ""Keep an eye out for anything,"" Salvucci says. ""It might try to use this plan against us.""\n\nYou reach the hanger in two minutes. You all peek through the threshold to see Markie advancing on a bloodied Strauss, who has her back to the hanger door. The captain's pistol is on the floor several feet from the pair.\n\n""She's wounded,"" Meat says, defeated. ""Infected.""\n\nMarkie is shuffling closer, giggling. Strauss sees the three of you. She looks over at the panel that controls the hanger door and then looks back at you all. She nods.\n\nYou slowly raise your pistol. Markie grabs the doctor by the throat and lifts her into the air. She chokes.\n\nYou feel Meat beside you raising his rifle. His hands are shaking.\n\n1.[[Mercy kill Strauss first.]]\n2.[[Go ahead and shoot the switch.]]\n"
"Comfort him by touching his shoulder.","He stops punching the wall after a while. Blood drips from his fingers. He breathes heavily.\n\n""He’s dead…because of us.""\n\n1.[[""Yeah? Well, let's make it fucking count.""]]\n2.[[""That's bullshit and you know it.""]]\n"
"""I have no idea, guys.""","""Would it kill you to be at least a little dishonest?"" Meat says, smiling. ""Somebody's got to be the optimist.""\n\n""Make your move already, dude,"" says Neil, growing impatient.\n\n""Fine. Zoe, we can talk strategy in a bit.""\n\nYou walk away.\n\n1.[[Talk to Strauss and Salvucci.]]\n2.[[Take a nap.]]"
"""Roger, roger.""","You go your separate ways, hiking down the cliff with Meat. It takes the larger portion of an hour to reach your tunnel.  You step inside and can’t help but feel that you’re entering the dark maw of a living planet.\n\n""Let's get our lights on.""\n\nYou both tell your suits to turn your on your light attachments. Yours flickers for a moment before shooting a cone of light from your chest compartment.\n\nOn the Head Up Display (HUD) of your suit, you can see the heartbeat monitors of everyone in your squad. You see that yours is going a little faster than normal and, knowing that everyone else can see that, you feel a little embarrassed.\n\nYou proceed through the cave.\n\n""You know what I want,"" Meat says. He doesn't wait for you to answer. ""I want a fucking taco. Beef. Cheese. Some guac on top. No more of this space bag food bullshit.""\n\n1. [[""Hot dogs, dude. Hot dogs.""]]\n"
"""I feel like nobody really wants to go down there, and that no one is going to say otherwise if we leave out some details out of our report. Sound good to everybody else? Good.""","""I can get behind that, totally,"" Ryan says.\n\n""I've heard worse ideas,"" Meat mutters.\n\nMarkie, however, slaps your arm. She lowers her voice to a whisper. ""Don't be such a pussy, Julia.""\n\nShe turns to the others.""Ryan, let Captain Salvucci know what we’ve found. Let’s try and get a pick-up at the LZ in two hours.""\n\n""Aye.""\n\n""That thing loaded, Meat?""\n\n""Duh.""\n\n""Okay, I’m thinking we should split up to cover more ground. How should we do this?""\n\n1.[[""I’m with Ryan.""]]\n2.[[""I’m with Markie.""]]\n3.[[""I’m with Meat.""]]"
"""Gee thanks.""","""Don't mention it,"" he says. He turns back to his computer. ""Right, hole patched. Get ready. And, uh, better luck this time.""\n\nHe presses [[a button.]]\n"
"Push Neil out of the way and lunge at Markie.","You push Neil to the side and ram the butt of the pistol into Markie's face. Flesh and pus and blood splash your arm; the revolting stench infilitrates your nostrils. You hit Markie in the face again and again. Her blood's on your face now, in your eyes, in your mouth.\n\nThe body goes limp. You stop. And then, finally having a chance to smell what you're covered in, you vomit.\n\n""Zoe?"" Neil says tapping you on the shoulder.\n\nYou respond by throwing up some more. You're lightheaded and swaying.\n\nNeil says your name again, but you can barely hear it over the screams, a woman screaming inside your head so loud it cracks the walls of you skull and sets your synapses aflame.\n\nIt's Markie. ""Mine,"" she shrieks. ""Mine!""\n\nYou're falling. You succumb to the dark. But in that darkness, she talks to you. Her voice mingling with a deeper one, the voice of the monster. Of the thing that killed her and Ryan and Strauss and Ben.\n\nYou are mine, it says, but you're stronger than those who have come before you. I cannot break your will so easily, so I offer you an opportunity: allow what's happening to you to happen and we can achieve the destiny of my race together. You will be a legend. If you do not, we will find another way. We've slept in the chambers of your planet for your species'entire existence, waiting. The stars are our destiny--not yours. Join us for infamy or sacrifice yourself for nothing. In the end, it matters not. We will prevail.\n\n1. [[Join the creatures.]]\n2. [[Sacrifice yourself.]]"
"""Bear the weight later. There are still lives in danger here.""","He nods. ""You're right. Need to focus on the task at hand. What do you think it is you found on Earth?""  \n\n1.[[""Yog-Sothoth?""]]\n2.[[""Not a damn clue.""]]"
"Wait in silence.","""Ryan, let Captain Salvucci know what we’ve found. Let’s try and get a pick-up at the LZ in two hours.""\n\n""Aye.""\n\n""That thing loaded, Meat?""\n\n""Duh.""\n\n""Okay, I’m thinking we should split up to cover more ground. How should do this?""\n\n1. [[Pair off with Ryan.]]\n2. [[Pair off with Markie.]]\n3. [[Pair off with Meat.]]\n"
"""Yeah. We just need to flush it out and kill it…somehow.""","""Yeah, I guess I should focus some of my mental energy on figuring out how to kill it instead of wasting it on fucking checkers, huh?""\n\n""Make your move already, dude,"" says Neil, growing impatient.\n\n""Fine. Zoe, we can talk strategy in a bit.""\n\nYou walk away.\n\n1.[[Talk to Strauss and Salvucci.]]\n2.[[Take a nap.]]"
"""Good luck.""","Meat nods solemnly and heads out the other sickbay door. You step outside to find Salvucci loading his pistol.\n\n""Better to be safe than sorry. Do you have your pistol?""\n\nYou nod.\n\n""Good. Hopefully we won’t need it.""\n\nThe two of you walk down the hallway. Salvucci appears to be deep in thought, distracted from his surroundings.\n\n1.\t[[""It’s not your fault, y’ know.""]]\n2.\t[[""You okay, cap?""]]\n"
"""The fucking thing ripped his head off.""","""Fuck. All right, let’s get her aboard.""\n\nYou and Meat help Markie to the ship’s elevator. Meat enters a combination on the keypad and the door slides open. Inside the elevator, as you ride up, all three of you remove your helmets. You notice for the first time that your face is drenched in sweat.\n\nA ding. The door opens. Captain Jonas Salvucci, an older, muscular man with little patience of tomfoolery, awaits you—his hand wrapped around the pistol in his holster. He takes his hand away from the gun when he sees there’s no threat.\n\n""Get her to sickbay.""\n\nYou nod and help Markie through the hallway of the ship. Behind you, you can hear Salvucci interrogating Meat.\n\n""What happened to Ryan?""\n\n""He's dead, cap. Something got him.""\n\n""Hell, Travis. What did you find down there?""\n\nWhen you get to sickbay, both Lenore Strauss, the doctor, and her geeky assistant Ben are prepping the examination table.\n\n""Where’s she wounded?"" Lenore asks, as you help a woozy Markie out of her suit.  You glare at Ben as he gawks at her well-toned body. He smiles sheepishly and looks away, cheeks burning red with shame. Markie’s drenched in sweat; she stares around wildly as Lenore straps her in. Strauss examines the bite: it’s just above the elbow, an inflamed bulging of the skin.\n\n""And I was young and we were running,"" Markie rambles, ""eyes bouncing up and down the shore  while the sun cooked the corpses of washed up jellyfish.""\n\nYou turn to Lenore, who’s prepping some kind of tool.\n\n1.[[""What the hell is she saying?""]]\n"
"Talk to Neil and Meat.","You approach the table. Neil takes one of Meat’s checkers.\nThey look up at you.\n\n""Thought we’d see a lot of boring shit on this trip, but I can honestly say I didn’t expect to run into a fucking alien,"" Meat says.\n\n""Is it an alien, though? I mean, maybe it’s just something that’s been in the Earth the entire time?""\n\n""Shut up, Neil. You know what I meant.""\n\n""Hey, I’m just saying that maybe we should be a little more careful about the terms we’re throwing around, y’know, for science?""\n\n""Just play the damn game. "" He turns to you. ""How are you holding up, Zoe?""\n\n1.[[""Good, all things considered.""]]\n2.[[""The fuck you think I'm holding up?""]]"
"Disapprove of her.","You never make your dislike of your daughter-in-law known, but she can sense it. You never become close.\n\nYou wake up one morning to find your husband cold on the patio. You get down on the floor and hold his corpse for hours before you finally dial the operator and tell the poor man on the other end that your husband is dead and you have no clue what to do. He takes your address and promises he'll send an ambulance.\n\nThey come. Your heart shatters when they zip him in a bag.\n\nLater, weeks after the funeral, Meat comes to stay for a couple of weeks. He’s bald and uses a cane because of a bum leg. You watch reruns of sitcoms and play chess. You talk of your loved ones and your children. Then, unexpectedly, he brings it up: ""Do you ever think of them? The crew?""\n\n1.[[""I do.""]]\n2.[[""I don't.""]]\n3.[[""What's the point?""]]"
"""Ditto.""","""I guess so. Come on. Let's go...let's go see Neil. Just to be sure.""\n\nIn the kitchen, you find the charred corpse of Neil. Meat stands over him and retrieves the broken pistol fragments from his hand.\n\n""You think we could have saved him—saved all of them--if we had made different choices?""\n\n1.[[""We're still breathing.""]]\n2.[[""I don't know, Meat. I don't want to know.""]]\n3.[[""We did our best.""]]\n\n"
"Blast Ben.","You go for your gun, but someone beats you to the trigger. A shot tears off Ben's lower jaw, sending it flying into the wall. The second splits his forehead. The body falls back onto the floor and continues to gurgle.\n\nYou turn to see Strauss holding up the captain's pistol, tears in her eyes.\n\n""Doc,"" Meat says, but she walks past him and continues to fire round after round into the corpse. Ben goes silent and still.\n\n""Lenore,"" Salvucci says, reaching out to comfort her.\n\n""We have to burn him too,"" she says, no hint of emotion in her voice. ""Don't touch him. Don't want to risk infection anymore than we have already.""\n\n""What about airborne infection?"" Salvucci asks.\n\n""What of it?"" she says. ""If it's airborne, we're dead anyway.""\n\n""I'll go get some oil then,"" say Meat.\n\n""And I'll check on the console in the cockpit and hope to god Neil had enough time and selflessness to set up our autopilot. Zoe, why don't you go get our cryopods ready?"" the captain says.\n\n1. [[Go to the cryopods.]]"
"Don't touch him","The captain and Meat continue to examine the rest of the room for clues of the creature's whereabouts. You wait for Ben to finish sobbing so you can continue your conversation.\n\nHe stops crying, but it's not because he's calmed down. His eyes widen as he looks at something behind you. Instinct guides you toward the rifle on the floor, but you're thrown to the side before you can even touch it.\n\nYour shoulder slams into the ground and goes numb. Looking up, you see Markie straddling Ben, a scalpel in her hand. She’s giggling. You can only see the side of her face but you know that your friend is gone. Blood and grime are dripping off her body, and her skin is peeling.\n\nAs if to remove all trace of doubt the creature inside her speaks: ""Now now, teacher’s pet, no one likes a tattletale.""\n\n""The hell?!"" Meat roars, whirling around. Too late.\n\nThe monster slams the scalpel into Ben’s face, sinking the blade into his right eyeball.\n\n1. [[Go for the gun.]]\n2. [[Scream helplessly.]]\n"
"""What’s waiting for you back on Mars?""","""What kind of question is that? Here and now? You’ve never made the effort bef—oh, I see. You’re just trying to make conversation. Well, fine then: I have nothing waiting for me. How does that sound? Nothing. Not a lover, not a child, not even a pet. This was my life and now it’s gone to shit.  Well now I feel good about myself. How about you.  Any boys waiting for you?""\n\n1.[[""No, I don't.""]]\n2.[[""Yeah, I do.""]]"
