incoming,text
"“What do we do?""",""""Should we look for it?""" Neil says.\n\n“Fuck that!” Meat says, turning. He aims his assault rifle at the first speaker and dismembers it with a single shot. He takes the second, third speakers out of commission as well. The music is no longer overpowering, but you can hear its echoes in the hallway.\n\n“Brutal but effective,” Strauss comments.\n\nSalvucci frowns. “You’re footing the bill for that when we get back.”\n\nNeil raises his finger. “Guys, now that Julia is awake, I think we should talk strategy. I just finished with our travel projections,""" Neil says.\n\n“And?” Strauss says, as though she knows what’s coming next.\n\n“Well, it’s like you said, doc: not good. Two months to Mars."""\n\n“We could last that long,” Salvucci says. “We ration food, ammo, go in groups to the rest of the ship when we need supplies.”\n\n“Captain, permission to speak?” Meat says.\n\nSalvucci nods.\n\n“That’s a horrible idea. We’ve got guns. Why don’t we use them? For all we know, that beastie thing could be growing. We need to hunt it down and kill it now.”\n\n“Travis, I put a gun against Markie’s head and blew her brains all over the floor. Apparently the thing inside her shook it off and walked away. I don’t think bullets are going to save us.”\n\n“Then we destroy the body completely,” Meat suggests. “Shoot it, stomp it, burn it, and then jettison the motherfucker into space.”\n\n“Captain, I don’t like either choice, but I think the more cautious one would be eliminating its presence from the ship,” Strauss says slowly.\n\n“Didn’t you say something about it being airborne?” Salvucci asks. “Could killing it infect one of us?”\n\nStrauss sighs, shrugs. “There’s no way to be sure. I didn’t get to run any tests on it. However, I’d rather take a chance on that possibility than risk us starving ourselves into easy prey.”\n\nSilence fills the common room. Then—\n\n“What do you think, Julia?” Neil asks.\n\nEveryone turns to you.\n\n1.\t[[“Let’s kill it.”]]\n2.\t[[“Let’s wait it out.”]]"
"Continue onward to the mess hall.","You proceed into the mess hall.\n\n"""Check everything,""" Salvucci orders. You check around the tables and near the entertainment closest while Meat looks around the kitchen. Salvucci keeps his eyes on the door.\n\nYou find some of you soy raisin cookies and pocket them. No monsters, though.\n\nMeat pokes his head out of the kitchen. """Nothing."""\n\n"""Shit,""" Salvucci says. """I guess we should go to the ba--""" A high-pitched scream cuts him off. Then, gunfire.\n\n"""Strauss,""" Salvucci says.\n\n"""Well, come on, let's go,""" Meat says, running out of the kitchen, rifle in hands.\n\nAll of you run out the door and down the hallway toward Neil's cockpit. You're halfway there when you spot a sticky mass of flesh and blonde hair on the ground.\n\n"""It's Ben,""" Meat says.\n\nYou're almost to the body when Strauss, hair a mess and her cheek dripping with blood, steps out from the corner. Her shaky hands are gripped around the captain's pistol, a gun aimed at all three of you.\n\n1. [["""Doc, put the gun down."""]]\n\n"
"“Got it.”","The groups go their separate ways; you hike down the cliff with Meat. It takes the larger portion of an hour to reach your tunnel. You step inside.\n\n"""Let's get our lights on."""\n\nYou both tell your suits to turn your on your light attachments. You flickers for a moment before shooting a cone of light from your chest compartment.\n\nThe two of you proceed through the cave. On the Head-Up Display (HUD) of your suit, you can see the heartbeat monitors of everyone in your squad. You see that yours is going a little faster than normal and, knowing that everyone else can see that, you feel a little embarrassed.\n\nYou proceed through the cave.\n\n"""You know what I want?""" Meat asks. He doesn't wait for you to answer. """I want a fucking taco. Beef. Cheese. Some guac on top. No more of this space bag food bullshit."""\n\n1.[["""Pizza."""]]\n2.[["""Space food's not so bad."""]]"
"""We need to go. Now!""","“Meet us at the center of the crater!” Markie yells over the comm.\n\nYou look at Ryan’s heart monitor: he’s about to flatline.\n \nThat’s when you hear the roar from the black.\n\nYou have a single bullet left.\n\n1. [[End Ryan's pain.]]\n2. [[Shoot the monster.]]"
"""Yeah, well, let's make sure he died for something worth dying for.""","“Yeah,” he says, not meeting your eyes. “I guess so.”\n\n“He gave you a password, right?” Strauss says. “Maybe there’s an autopilot sequence on his computer.”\n\n“Doesn’t do us any good if that thing is still stomping around.”\n\n“Do you really think it survived that blast?”\n\n“Is that a serious question?”\n\n“Either way, we need to get the ship moving. Let’s get to the cockpit and decide what to do there.”\n\nYou make your way toward the cockpit. About halfway there, Meat speaks.\n\n“What was it doing when it killed Neil?”\n\n“Evolving,” Strauss answers.\n\n“Did you get a good look at it?” Meat asks.\n\n1.[["""It wiggled a lot."""]]\n2.[["""I did not. I was too busy running for my life."""]]\n"
"""Well, you are ideal bait...""",""""When I was asking for support, I didn't mean that kind of support."""\n\n"""You'll be fine, son,""" Salvucci says.\n\n"""We'll cut that fucker down before it even gets close."""\n\n"""Reassuring. Really. So can I at least have the knowledge of where I'm going to die before we get there?"""\n\n"""Sickbay,""" Salvucci says. """Tight space, we'll wait on the outside."""\n\n"""Sickbay,""" Neil repeats. """I'm going to die in sickbay."""\n\n"""Just move it,""" Meat says. """The sooner we get there, the sooner we kill it."""\n\nYou notice a trace of uneasiness in Meat's voice.\n\n1.[[Onward to Sickbay.]]"
"""You're not even real.""",""""No,""" she says, turning away from you. """But it is."""\n\nYou turn just in time to make out the tentacle that rends your head from your body.\n\nThe last sound you hear is the beast roaring with satisfaction.\n\nThe End"
" Pull out your pistol and fire blindly.","Meat fires the rifle across the room, the gun’s light chasing Markie’s feet as she darts away. You raise your pistol and fire blindly in front of Meat’s light, hoping to hit her with a lucky shot. Beside you, Neil screams in terror.\n\nYou hear the tell-tell click of the rifle as the clip goes dry. Meat swings the rifle around to point the flashlight at the door.\n\n“Go!”\n\nYou all make a beeline for the door. Meat yanks on the handle and light bleeds into the darkness, as all three of you sprint into the hallway. You slam the door and then bend over to catch your breath. Luckily, you manage to pull back just in time to avoid the spew of vomit that erupts from Neil’s mouth.\n\n“That was Markie—our Markie?” he says, wiping the spittle from his lip.\n\n“Yeah, it was,” Meat answers, a tinge of sadness in his voice. He reloads the clip. “This is my last one.”\n\n“Why didn’t she attack us?”\n\n1.[[“She wants us to run out of resources.”]]\n2.[[“She’s toying with us.”]]\n\n\n\n"
"Also sulk in silence",""""Guess not,""" he says, seeing the expression on your face. \n\n"""I'll just go over here and play with this tablet."""\n\n"""Idiot,""" you hear Strauss mutter.\n\nYou take a seat on the examination table and look around the wrecked room. You're staring at the bloodstains left by Ben's corpse when the door opens and in walk Meat and Salvucci; both men wear dark expressions.\n\n“I’m guessing your hunt was uneventful?” Strauss says.\n\n“Yeah, go on and rub it then,” Meat says, turning to rifle through the medical cabinets.\n\n“What are you looking for?”\n\n“Food.”\n\n“This is a medical facility. What makes you think there’s food in here?”\n\nMeat opens one of the lower cabinets and, after a moment, pulls out a large bag of apricot chips.\n\n“Your assistant told me about his stash a while back.”\n\n“I’m glad you can eat his food while his blood is smeared all over the floor."""\n\n“Not like he’s going to need them,” Meat says with a shrug.\n\n“Enough you two,” Salvucci barks. “Pilot, you all right?”\n\n“Yeah, I’m fine, captain. Thanks for asking.”\n\n“Did you three see anything?”\n\n“No,” Strauss says.\n\n1.[[“Where did you look?”]]\n2.[[“Did it leave any sort of trail?”]]"
"""We can't turn on each other, man.""","“Sorry,” he says. “She’s just getting on my nerves. I know she’s had it rough. She and Ben were a thing, so she’s on edge even more than usual, I guess.”\n\nThe two of you enter the cafeteria and then, after taking a precautionary look around, you go into the kitchen and begin to stuff everything you can get your hands on into the two bags you brought from sickbay: fruit chips, soda, water bottles, pastries, canned soup.\n\nWhen you’ve filled the bags, you leave the cafeteria and make your way to the common room. Strauss, Neil, and Salvucci are waiting. The common room is a circular room with a couch, several chairs, and a large wall-mounted monitor connected a server archive of countless movies, shows, and documentaries.  \n\nOn the back wall, there are portholes—just like on the ships of old that sailed the waters of Earth—where you can gaze into the dark of space.\n\n“Run into any trouble?” Salvucci asks as you hand him the bag.\n\n“Didn’t see a damn thing,” Meat says.\n\n“I’m telling you,” Strauss says, rubbing her bandaged arm, “we won’t see it until it wants us to see it.”\n\nMeat grumbles something about paranoia and then heads over to the table, where Neil is setting up a checkers board.\n\n“How’s your arm, doctor?” Salvucci asks.\n\n“Fine, captain. Thank you.”\n\nYou're a bit tired.\n\nWhat should you do?\n\n1.[[Talk to Neil and Meat.]]\n2.[[Take a nap.]]\n"
"Rock, Paper, Scissors","You go four rounds. Neil wins two of them (rock over scissors each time). You with the other two times, with paper over rock.\n\nYou’re about to start the fifth round when the second door to sickbay opens, and Meat and Salvucci step inside; both men were dark expressions.\n\n“I’m guessing your hunt was uneventful?” Strauss says.\n\n“Yeah, go on and rub it then,” Meat says, turning to rifle through the medical cabinets.\n\n“What are you looking for?”\n\n“Food.”\n\n“This is a medical facility. What makes you think there’s food in here?”\n\nMeat opens one of the lower cabinets and, after a moment, pulls out a large bag of apricot chips.\n\n“Your assistant told me about his stash a while back.”\n\n“I’m glad you can eat his food while his blood is smeared all over the floor."""\n\n“Not like he’s going to need them,” Meat says with a shrug.\n\n“Enough you two,” Salvucci barks. “Pilot, you all right?”\n\n“Yeah, I’m fine, captain. Thanks for asking.”\n\n“Did you three see anything?”\n\n“No,” Strauss says.\n\n1.\t[[“Where did you look?”]]\n2.\t[[“Did it leave any sort of trail?”]]\n\n\n"
"Lunge at Markie.","You push Neil to the side and ram the butt of the pistol into Markie's face. Flesh and pus and blood splash your arm; the revolting stench gets in your nostrils. You hit Markie in the face again and again. Her blood's on your face now, in your eyes, in your mouth.\n\nThe body goes limp. You stop. And then, finally having a chance to smell what you're covered in, you vomit.\n\n"""Julia?""" Neil says tapping you on the shoulder.\n\nYou respond by throwing up some more. You're lightheaded and swaying.\n\nNeil says your name again, but you can barely hear it over the screams, a woman hollering inside your head so loud it cracks the walls of you skull and sets your synapses aflame.\n\nIt's Markie. """Mine,""" she shrieks. """Mine!"""\n\nYou're falling. You succumb to the dark. But in that darkness, she talks to you. Her voice mingling with a deeper one, the voice of the monster. Of the thing that killed her and Ryan and Strauss.\n\nYou are mine, it says, but you're stronger than those who have come before you. I cannot break your will so easily, so I offer you an opportunity: allow what's happening to you to happen and we can achieve the destiny of my race together. You will be a legend. If you do not, we will find another way regardless. We've slept in the chambers of your planet for your species' entire existence, waiting. The stars are our destiny--not yours. Your struggle is inevitable. Join us for infamy or sacrifice yourself for nothing.\n\n1. [[Join it.]]\n2. [[Sacrifice yourself for humanity.]]\n"
"""I am so close to shoving that saw up your ass.""","She doesn't turn to look at you. """Yes, yes, you're very frightening, Zoe. Now go away."""\n\nYou leave before your anger gets the best of you.\n\n1.[[Go eat something.]]\n"
"Look where she's pointing.","Markie's nametag, covered in grime.\n\n"""So, she's like dead, right?""" Neil says, picking gunk out of his hair. """We're safe now."""\n\n"""Why did she die, though? And why like that?""" Salvucci asks.\n\n"""Travis,""" Strauss says. """What did you say earlier?"""\n\n"""What?"""\n\n"""You said something a minute ago. What was it?"""\n\n1.[["""He said it was a bomb."""]]"
"""She wants us to run out of ammo.""","“She’s doing a hell of a job of it, then. Played us like a fuckin’ fiddl—”\n\n“Zoe! Neil! Anyone!” Your walkie comes to life; it’s Strauss, her voice filled with panic.\n\nYou pull the walkie off your belt loop.\n\n“Please help us!” Strauss cries. “The captain keeps shooting but it’s not doin—oh god.”\n\nNeil looks at you in horror. You click the button on side the side of the walkie. You say:\n\n1.[["""Hang on! We're on the way."""]]\n2.[["""That's what you get."""]]\n\n"
"“Captain…”","“I already took one risk today, Julia, and that got someone else killed. Superstitious or not, we’re doing this. Now come on.”\n\nSalvucci leaves the room. You turn to look at Meat. He’s pale.\n\n1.[[“Good luck.”]]\n2.[[“Be careful.”]]\n3.[[“You sick fuck.”]]\n"
"""Whatever it is, we've got enough firepower to put it down.""","Salvucci's furrows his brow. """Not a comforting answer."""\n\n“What killed Ryan?” Neil continues.\n\n“Stop talking, Neil,” Salvucci says with a raised voice before turning back to you. “Maybe Strauss was right.”\n\n“Captain, I have to insist. Ryan is a childhood buddy. I know his family. Somebody tell me what’s going on.”\n\n“Ryan got killed by some fucking thing,” Meat says. “Almost got us too. Up to speed, dipshit? Let the adults talk now.”\n\nNeil sinks back into his chair. “He’s dead,” he says in disbelief.\n\n1.[["""We're going to be that way too if we don't get our head in the game, Neil."""]]\n2.[["""Suck it up, Neil. Cry later."""]]"
"Kill her.",""""I...I had to,""" she stutters. Everyone watches as you pick up your pistol and stick the barrel against her chest.\n\n"""Do it,""" Meat growls.\n\n"""Zoe, let's think about this,""" Neil says, sweating.\n\n"""There wasn't any other way, please, Zoe. He would have killed us."""\n\nThe first shot sends her reeling, clutching the wound with her hands.\n\n"""Stop!""" Neil yells.\n\nMeat points his pistol at her as well.\n\n"""Guys, guys stop,""" Neil screams.\n\n"""Burn,""" Meat tells her. He fires a shot into her chest. She gasps and falls to the ground.\n\nYou aim at her head and squeeze the trigger one last time. She goes still.\n\nMeat leans over and spits on her body.\n\nNeil moans in horror. """Travis..."""\n\n"""She would have killed us, man; the moment she saw any of us as a threat, she would have killed us without a thought, just to save her sorry hide. Good riddance."""\n\nMeat lights up his molotov and throws it atop Ben and the captain's corpses.\n\n"""So, uh, what do we do now?""" Neil says, watching the bodies burn.\n\n"""We're not done hunting, Neil."""\n\n"""With what? You saw what bullets did to Ben: took a whole damn clip and then some."""\n\n"""We'll have to improvise, won't we? I don't know about you, but I sure as fuck don't plan on being some monster's dinner."""\n\n1.[["""We draw it out."""]]\n\n"
"""I killed Neil and Markie.""",""""Shit. I'm sure you did what you had to. Make your way back to the hall."""\n\nYou do so. Meat and Salvucci are below you, waiting. Meat looks away from you.\n\n"""Are you sure it's dead?""" the captain asks.\n\n1.[["""It's not getting back up."""]]\n2.[["""I think so...but I couldn't tell for sure."""]]\n"
"StorySettings","jquery:off\nhash:off\nbookmark:on\nmodernizr:off\nundo:on\nobfuscate:off\nexitprompt:off\nblankcss:off\n"
"""Not even a simple 'thanks?'""",""""You're right. You saved my life and I'm grateful for that. I just hope you did more than briefly delay my demise."""\n\n1.[["""Any ideas how to beat that thing?"""]]"
"""Come on. Let's get out of here.""","“Yeah, let’s.”\n\nThe two of you walk back through the hallway leading to the hanger and then to the cockpit. The bodies of your crew are still there. Meat stares at them.\n\n"""Do you think if we had made different choices, they'd still be alive?"""\n\n1.[["""I really don't know."""]]\n2.[["""Does it matter?"""]]\n"
"""You're not fucking real.""",""""No,""" she says, turning away from you. """But it is."""\n\nYou turn just in time to make out the tentacle that rends your head from your body.\n\nThe last sound you hear is the beast roaring with satisfaction.\n\nThe End\n"
"“Is your suit ripped?”","“I’m fine. The hole isn’t that big.”\n\n“What happened to Ryan?” Meat shouts over the roar of Speedwell’s engine as the ship lands.\n\n1.[[“Fucking thing ate him.”]]\n2.[[“It happened so fast.”]]\n"
"""Stay alive.""",""""You too, princess."""\n\nHe gets in position. A second later, the door bursts open and flies across the hanger. In steps the monster, eyes looking about wildly.\n\nIt takes a step toward you.\n\n“Over here, motherfucker!” Meat shouts through his suit’s comm.\n\nIt growls and moves toward him. Its footsteps leave imprints in the steel floor.\n\nMeat backs away from the droids until his back is pressed against the wall. He grabs onto a wall-railing.\nThe monster steps in front of the line of droids.\n\n“Do it, do it now.”\n\nYou take aim at the switch on the far wall. You fire.\nThe shot slams into the switch, and the alarms blare. Meat slowly pulls himself along the rail until he’s behind the droids.\n\nThe hanger door opens and air swooshes out. You grip the railing beside you.\n\n“Hold on!”\n\nThe beast begins to backslide toward the hanger door, its feet dragging. It tries to throw a tentacle at Meat, but they’re pulled as well. Seconds later they snap off and go flying into the black.  \n\nMeat, clinging to the railing, kicks the droids. It takes a second for them to detach from their holders and tumble down into the behemoth. The first one knocks it back a couple of feet. The second droid seals the monster’s fate, knocking it off both of its feet and sending it careening into the stars.\n\n“Eat shit and die, you fuck!” Meat screams through the comm. You can’t help but grin as the monster spins out of sight.\n\nThe alarms in the hanger continue to yell for a couple of seconds, and then the emergency seal protocol activates, and the hanger door slowly slides to a close again.\n\n“We did it,” Meat says. “We fucking did it.”\n\nHe walks over to you and hugs you tightly. You both laugh. \n\n“We’re alive!”\n\n1.[["""Come on. Let's get out of here."""]]"
"""This plan sucks.""",""""Yeah, well this is officially plan Z. There is no other plan."""\n\nThe door behind you clangs.\n\n"""Shit,""" Strauss says, coating the last bullet. """At least we don't have to bait it now.\n\nA louder bang now. A tentacle penetrates the door.\n\n"""Come on, let's go!"""\n\nYou leave through the other sickbay door. In the hallway, she hands you your pistol. You find the viewport. It's a spacious square of glass that takes up half the wall. Behind you, there is the sound of giant, reveberating footsteps.\n\n"""He's coming. You get near the switch. I'll jump back after you shoot the window.""" Strauss positions herself near the window; you stand next to the switch. \n\nThe creature approaches. It growls as it lumbers toward the doctor. Both the monster and Strauss are close to the window now.\n\n1. [[Shoot the window.]]\n2. [[Shoot Strauss first.]]"
"Leave him be.","He stops punching the wall. Blood drips from his fingers. He breathes heavily.\n\n“He’s dead because of us.”\n\n1.[["""Yeah, well, let's make sure he died for something worth dying for."""]]\n2.[["""Get your head in the fucking game."""]]"
"Laugh.","You all laugh. You see a smile creep onto Salvucci's face.\n\n"""You're the reason we're alive. You can expect great things when we get back."""\n\nBoth Meat and Neil help you into your pod. \n\n"""Don't worry, you won't be the only human popsicle. We're just going to make sure the ship's clean before we all go to sleep. Rest easy."""\n\n1.[["""Yeah, yeah, get on with it."""]]\n2.[["""When I wake up, I expect to have kickass robo-limbs."""]]\n"
"""Erosion...right.""","“It doesn’t work like that, Ryan. I’m reading at least seven tunnels, carved out exactly the same size.”\n\n“Meaning what?”\n\n“There might be something down there.”\n\n“Spooky,” Meat says, peering at the expanse of the crater.\n\nFor a moment no one says anything.\n\n1.[[“We should check it out, right?”]]\n2.[[“Let’s check it out.”]]\n3.[[“I feel like nobody really wants to go down there, and that no one is going to say otherwise if we leave out some details out of our report. Sound good to everybody else? Good.”]]\n4. [[Absentmindedly kick rocks while you wait for someone to answer.]]\n"
"Save yourself.","It's a hard choice, but in the end, you get to your feet and sprint past the monster as it slaughters Strauss and Meat. You can hear their screams as you run down the hall. Soon things are mercifully silent. \n\nYou climb up into the ventilation and decide to make your base of operations there. You're a survivor, you tell yourself. All you have to do is stay alive two months. That's all.\n\nYou go, day by day, into the ship in search of supplies. You often go to the mess hall to stock up on food and bring it back to the vents. You run into the creature twice. Each time it's grown bigger, nastier. The first time, you get away without a scratch.\n\nThe second time, a tentacle pierces your ankle. You still manage to hop away, but you can't climb into the vent because of your injury. You seek refuge in the darkness of the barracks. Soon every breath brings pain. You refuse to accept the hand you've been dealt, even when Strauss, half her head missing, sits down beside you to have a chat.\n\n"""You had a good run, idiot,""" she says. You stare at her ravaged face. \n\n1.[["""You're not real."""]]"
"""Except for the dead.""",""""Yeah,""" he says, his smile fading. """Except for them."""\n\nNeither of you says a word for a moment. Meat breaks the silence. """I'm gonna go tell them you're awake and we'll get your pod ready."""\n\nHe leaves and comes back a couple minutes later, grabbing a wheelchair from the corner of the room. """All right, let's get you in. Just don't look at your foot."""\n\nHe helps you into the chair.\n\n1. [[Look at your foot.]]\n2. [[Don't look at your foot.]]\n"
"Give Meat the walkie.","Meat takes the walkie. """Neil?"""\n\n“She’s fucking here, guys. She reeks.”\n\n“Sit tight,” Meat says. He nods at you. Both of you creep to the door. Meat pushes it open slightly and peers out. You look out as well.\n\nNeil is backing into a wall, face red and dripping with perspiration. Several feet away is Markie. You can smell her from here, but that’s not what’s making you struggle not to gag. Her face is a jagged piece of flesh hanging from her skull, her sockets void of eyeballs.\n\n“Stay away from me,” Neil begs.\n\nIt lumbers toward the pilot, groaning. Several teeth fall to the ground in a mixture of salvia and blood.\n\n“Now,” Meat says.\n\nThe two of you emerge from the kitchen. Markie doesn’t even have time to turn her head before rifle fire rips the neck from her body and her head tumbles to the floor, smashing to the ground like a pumpkin.\n\nMeat opens his mouth to let loose a witty remark, but vomit emerges. You’re not far behind, the smell finally having gotten the best of you. Luckily, there’s not much for you and your partner to barf up.\n\n“Oh godfuckingshit,” Neil yells. “That was Markie.”\n\nHe takes a step closer to the body.\n\n“So, we like win now, right? They’re all dead?”\n\n“Yeah, I think—”\n\nMeat is cut off by the sound of Markie’s hand slapping the floor as the body convulses, pus and blood shooting from the decimated neck stump. He fires the rest of the clip into the corpse.\n\n1. [[Shoot it!]]\n2. [[Dart into the kitchen.]]\n"
"End your life.","No sense in delaying the inevitable.\n\nYou press the gun against your temple. You pull the trigger. You lifeless body collapses onto the floor to join the others.\n\nYour ship drifts through space for nearly a decade until it finally collides with an asteroid and explodes, vaporizing your corpses.\n\nThe End\n"
