incoming,text
"“42.”",""""While I appreciate your clever literary reference, that is not in fact the password."""\n\nStrauss slams the fist of her unwounded arm against the door.\n\n“Listen here, you little shit. You open this door right now or so help me I’ll put you to sleep, slather whatever honey we have left in the cafeteria on your testicles, and we’ll use you as bait.”\n\nThe door slides open. Neil’s face, boyish as ever, awaits you and Strauss. He is unharmed.\n\n“It eats honey?”\n\n“I don’t think I’ll ever be able to fathom the depths of your stupidity, pilot.”\n\nNeil frowns; he seems genuinely hurt by the remark.\n\n1.[[“Let’s just go.”]]\n2.[[“ Doctor Strauss is right; stop dicking around, Neil.”]]\n3.[[“Take it easy on him.”]]\n"
"Go to the cockpit.","You and Meat follow the captain to cockpit. Neil, the ship’s pilot, sits at the controls. He smiles when the three of you enter--he has a thing for you.\n\n“Hello darling.”\n\n“Cut the shit, Neil,""" the captain barks.\n\n“Yes, captain,” he says, deflated.\n\n“Meat take over the co-pilot controls for Markie.”\n \nMeat nods, takes a seat. Neil looks over at him. “You’re a bit pale, big boy. Something happen?”\n\n“Shut the fuck up, Neil. Just do your job.”\n\n“Sheesh.”\n\nSalvucci turns to you. “Okay, I need you to be straight with me: what are we dealing with? Do you think she’s going to turn into whatever killed Ryan?”\n\n“Woah, shit,” Neil says, turning in his seat. “Ryan’s dead? What happened?”\n\n“Leave it alone,” Meat says.\n\n“Julia?” Salvucci says.\n\n1.[["""Look, all I know is that whatever we found on Earth wasn't human."""]]\n2.[[“We’ve got guns;we can handle her if shit goes down."""]]\n"
"""Just a rock or something.""","The words aren't out of your mouth when you hear it again: scuttling, and then something else--a high pitched whine that sends a shiver down your spine.\n\n"""We're not alone,""" Meat says, voice low.\n\n"""What's that?""" you hear Ryan say over your comm.\n\n"""There's something in here with us. We're turning back."""\n\nHe nods at you and you both slowly back away. You pull out your pistol.\n\n"""What do you see, Meat?""" Markie asks.\n\n"""Dunno. Sounds like a wolf. Don't like it whatever it is."""\nThe whine again. You focus your eyes and see something moving in the dark.\n\nMeat sees it, too. He fires at it. As muzzle fire fills the cave with flashes of light you see that the creature isn't one thing: but many things, with feelers and sharp teeth.\n\nThey rush toward you, hundreds of them.\n\n"""Let's get out of here,""" Meat yells.\n\n1. [[Blast 'em.]]\n2. [[Get out of there.]]\n"
"“That was a bit harsh, Doc.”","She looks at you coldly. """I answered his question."""\n\nThe three of you say nothing for the rest of the walk, but you can’t shake the feeling that Neil is angry at you.\n\nWhen you reach the sickbay, it’s deserted.\n\n“I suppose those fools are still out looking for it—or they’re dead.”\n\n“Holy shit,” Neil says, approaching the puddle of gore in the center of the room. He stands there, gazing down at it. \n\nYou lean against the wall and take a seat, but your pistol remains in your hand. \n\n“Meat and the captain aren’t really dead, are they?”\n\n1.[[“No. Of course not.”]]\n2.[[“Who knows?”]]\n3.[[“Yeah, they’re food.”]]\n\n"
"“Yeah, they’re food.”",""""What the fuck, Julia?"""\n\nHe turns to Strauss. “When are they supposed to be back?”\n\n“An hour from when we left,” Strauss says.\n\n“How long ago was that?”\n\n“I don’t know. I’m not your timekeeper."""\n\n“Sheesh. Well, okay, so what should we do to pass the time?”\n\n“Time’s going to pass regardless of what we do with it.”\n\n“Right. So you’re going to sulk over there in the corner. Fine.”\n\nHe turns to you. “Julia?”\n\n1. [[Rock, Paper, Scissors]]\n2. [[Tic-Tac-Toe]]\n3. [[Also sulk in silence]]"
"""Yog-Sothoth?""","“What’s that? Oh, you’re making a joke, aren’t you? Hardly the time, Zoe.” He says, giving you a sharp look of disapproval. He sighs.\n\n“Maybe Strauss will know what it is—if she’s still alive.”\n\n1.[["""Don't talk like that, cap."""]]\n2.[["""She's meat."""]]\n\n"
"Take a nap.","You walk over to the bar and take a lie down. It feels like it’s been years since you’ve slept, but you’re afraid to go to sleep, uncertain of whether you’ll relive the horrific deaths of your crewmates in your dreams. Terror is not enough to keep you from closing your eyes, though. You’ll need your strength if you’re to survive the rest of the voyage.\n\nSleep comes easier than you expected. There are no dreams. At least, you don’t see anything. However, there are sounds. Clapping, to be precise.\n\nThe common room abruptly comes into view as Meat shakes you awake. The sound of clapping is engulfing the room. Getting to your feet, you see Strauss has her ears covered. A guitar now. Music playing.\n\n“Tequila!” the ceiling speakers shout. \n\nYou turn to Meat.\n\n1.[["""What's with the racket?"""]]\n"
"“It might be for the best.”","“I guess. There’s just something about Strauss, though, y’ know? She really sets me on edge. I think she enjoys hurting people.”\n\n1.[[“You’re still angry about that time she reset your broken finger, you big baby.”]]\n2.[["""I get that vibe, too."""]]"
"Die.","Salvucci pulls out pistol and puts a round through Neil's forehead.\n\nYou close your eyes as he points the gun at you. You never open them again.\n\nThe End"
"“Did it leave any sort of trail?”","“Not a damn trace” Meat says before swallowing a chip. “Not in engineering, the cafeteria, the cryo room. We checked every nook and cranny. My guess is they’re in the vents.”\n\n“This is some fucked up shit,” Neil says.\n\n“Eloquent as always, pilot.”\n\n“We should move shop,” Meat says after a moment. “This facility has two doors. I don’t like that. Captain and I were talking; the common room is more safe and it’s closer to the cafeteria. We can make supply runs."""\n\n“…while we, what? Wait for the creature to die?” Strauss asks.\n\n“That’s the plan. We stay safe, let it starve.”\n\n“And what if it can wait longer than us? What if that’s part of the thing’s plan? Wait till we get sick and hungry enough for it to overpower us? Did you even bother thinking about the logistics of that move, you dunce? Cryosleep is part of the ship’s travel. We don’t have enough food on board to support us until we reach Mars. We have maybe a month at the most before we run out. Then what?”\n\n“I don’t know, okay? I hear a lot of criticism but I don’t hear you contributing anything else, doctor.”\n\nStrauss scowls. “That’s because I’m trying to prevent you from leading us into a disaster.”\n\n“Can it, the both of you,” Salvucci commands. “Meat’s right as far as safety precautions go. The common room will be easier to fortify and protect than this place. We can worry about long term plans once we get set up there. Doc, you and Neil grab whatever supplies you think we might need from in here. Travis, you and Julia make a trip to the cafeteria, bag some grub, meet us in the common room. Be. Careful.”\n\n“Yeah, boss. Got it,” Meat says. “Come on, Julia.”\n\nThe two of you leave as Strauss, Neil, and Salvucci retrieve medical supplies.\t\n\n“You and the captain should have put a round in her when you found her,” Meat says as you walk toward the cafeteria.\n\n1.[[“Not funny.”]]\n2.[[“Your bickering is going to get us killed.”]]\n3.[[“It was tempting.”]]\n"
"""Meat, I don't know, okay?""",""""Guess it isn't much use wondering about it, huh?""" He turns away from them, though you notice his eyes lingering on Strauss' corpse for a moment.\n\n"""God, I just want some sleep."""\n\n1.[["""Come on. Let's sleep, then."""]]\n"
"""She's meat.""","You open your mouth to speak, but you're cut off by a familiar voice. “Well, captain, I guess it’s too much to hope for some confidence in my abilities.”\n\nOut from a supply closet steps Strauss. Sweat is dripping off her face and there’s blood on her lab coat.\n\n“Doctor, are you hurt?”\n\n“No,” she says. “It broke through the glass and grabbed me, but Ben pushed it off. I ran and didn’t look back. I heard him scream behind me.”\n\nSalvucci looks at you nervously.\n\n1.[["""Your boyfriend's toast."""]]\n\n"
"""I'm so sorry.""",""""What happpened? You can tell me,""" Salvucci says.\n\nThe barrel is cold beneath your chin. The thing screams, cursing your spinlessness.\n\nThe pistol erupts, silencing the voice and sending you careening into quiet, peaceful oblivion.\n\nThe End\n\n"
"""I don't know, Meat. I don't want to know.""","He sighs. """I want to believe you, but...nevermind. What now?"""\n\n"""Damn it. Can't do anything about it now but, fuck, they're dead. And they don't have to be."""\n\nHe runs his hand over his face to calm himself. """What should we do now?"""\n\n1.[["""We sleep."""]]"
"“I’m good.”",""""That makes one of us, at least. Level with me though. You think we got a chance against this thing? Whatever it is.”\n\nNeil leans in as well, clearly interested in your response.\n\n1.[[“Of course. We just need to flush it out and kill it…somehow.”]]\n2.[[“No idea.”]]\n3.[[“We’re screwed, fellas.”]]\n\n"
"“We’ve got guns;we can handle her if shit goes down.""","Salvucci furrows his brow. """Not a comforting answer."""\n\n“What killed Ryan?” Neil continues.\n\n“Stop talking, Neil,” Salvucci says with a raised voice before turning back to you. “Maybe Strauss was right.”\n\n“Captain, I have to insist. Ryan is a childhood buddy. I know his family. Somebody tell me what’s going on.”\n\n“Ryan got killed by some fucking thing,” Meat says. “Almost got us too. Up to speed, dipshit? Let the adults talk now.”\n\nNeil sinks back into his chair. “He’s dead,” he says in disbelief.\n\n1. [[Give him a comfort pat and offer your condolences.]]\n2. [[Refrain from doing anything.]]\n"
"Follow Meat and Neil.","“Everyone keep your wits about you, and let’s meet back here in an hour. You guys see if you can shut down that racket.”\n\nThe captain bends down and grabs something from the floor and tosses it in your direction. You barely catch the object: it’s a walke-talkie. \n\n“If you run into it, let us know."""\n\nWhen all of you get to where the hallways branch off, your group goes to the left. You take one last look at Strauss and Salvucci before they disappear around the bend. The walkie-talkie feels heavy hanging from your belt clip. \n\n“Scarborough Fair” plays loudly as the three of you carefully walk down the hallway. Meat has his assault rifle out, pointed dead ahead. Every now and then he’ll look to each side, though the hallway is really too narrow for anything else to fit alongside the rest of you.\n\nParsley, Sage, Rosemary and Thyme\nRemember me to the one who lives there…\n\n“You’ve got a weird taste in music, Neil.”\n\n“Don’t knock Lani Hall, dude.”\n\n“Why do you think it’s fucking with the music anyway?”\n\n1.[["""It's trying to scare us."""]]\n2.[["""It's covering its own noises."""]]"
"Shoot the window.","You unload your clip into the window. On the fourth shot you hear a sucking sound. \n\nBingo.\n\nThe doctor leaps back behind the door. You smash the button and the emergency door comes down between you and the beast. It wastes no time in striking at the door with its tentacles. You watch through the glass in the door as the viewport's glass cracks, shatters, and is sucked into space. The beast, though it tries to cling to the inside of the ship with its appendages, is sucked out shortly after.\n\n"""We did it,""" Strauss says, relieved. The alarms blare for a few minutes until the emergency panel comes down and covers where the viewport was.\n\nThe door in front of you lifts, giving you access to the rest of the ship again.\n\n"""I guess we should burn the other bodies. Just to be sure. I'll go to the lab and make some molotovs. You go get our cryopods ready."""\n\n1. [[Initiate you and Strauss' cryopods.]]\n\n"
"""Let him explain.""","“He might come back, y’know?” Meat says. “Like a zombie.”\n\n“Stop talking,” Salvucci says. “We need to find Strauss.”\n\n“If she isn’t dead,” Meat says grimly, eyes set on what’s left of Ben’s face.\n\n1.[["""Ben said she was chased into the hallway."""]]"
"""No, they're tough fuckers.""","“What makes you so sure?” Strauss sneers.\n\n1.[["""Watch your tone, Strauss. Getting real tired of your shit."""]]\n2.[["""Because I know what I'm talking about."""]]\n3.[["""Step off, cunt."""]]\n\n"
"“Not great.”","He sighs. """Figured as much."""\n\nThe PA clicks on: “All officers report to sickbay,” Salvucci says.\n\nMeat gobbles up the rest of his bowl and grabs the rifle leaning upright against the table. You realize that you’re out of ammo, so you take one of the clips from your belt and reload the pistol.\n\nYou and Meat exchange no words on the way to sickbay. The door is open when you get there. Salvucci, Lenore, and Ben are standing around a bloody examination bed. You look to the right: Markie, one arm missing, is sequestered in a see-through quarantine cube. She’s looking around wildly.\n\nYou smell gunsmoke. Ben has both of his hands wrapped around his pistol.\n\n1.[[“What happened?”]]\n\n\n\n"
"“What’s she saying?”","“Complete gibbersh, sounds like,” Lenore says with cold detachment. “Move.” \n\nShe scoots past you and turns on the device in her hand. A hot laser point darts out about three inches from the top port of the device. Another line escapes the bottom port and swings upward to connect to the top beam.\n\n“Cauterizing saw,” she explains. “You might want to leave this to the professionals, girlie. It’s going to get a little messy.”\n\n1.[[“Are you really going to take her arm off?”]]\n2.[[“What the fuck is wrong with you?”]]\n3. [[Say nothing; leave.]]"
"""We could just knock you out.""",""""That's a joke, right? You're joking."""\n\nMeat slaps Neil on the shoulder. “We won’t let you get eaten. Now stop being a pussy. You’re the tiniest one—the easiest prey, see?”\n\n“You’re not making this any more appealing.”\n\n“We can’t make him do this,” Strauss interjects, finally saying something.\n\n“When the fuck did you grow a conscience? “Meat growls.\n\n“I did what I did for the sake of survival. There were no other options. There are other options here. We just need to think rationally.”\n\n“Well,” Meat says. “I’m waiting, doctor.”\n\n“No,” Neil says. “I’ll do it.”\n\nYou turn to Neil.\n\n1.[["""You're certain?"""]]\n2.[["""Damn right you will."""]]\n\n"
"""Aye.""","Both groups go in a separate directions; you hike down the cliff with Ryan. It takes the larger portion of an hour to reach your tunnel. You step inside.\n\n“Flashlights,” Ryan says. You tell the computer to turn on the light attachment in your suit. It flickers for a moment before shooting a cone of light from your chest compartment.\n\n“Let’s do this,” he says, pulling out his pistol. You do the same.\n\nThe two of you proceed through the cave. On the Head Up Display (HUD) of your helmet you can see the heartbeat monitors of everyone in your squad. Yours is going a little faster than normal and, knowing that everyone else can see that, you feel a little embarrassed.\n\n“Ten bucks we find caveman drawings.”\n\n1.[["""Sure, Ryan."""]]"
"""Save a round for yourself...just in case.""",""""Way to be an optimist, Zoe,""" Meat says, clearly disapproving.\n\n"""No, it's okay,""" she says, nodding. """It's good advice.""" She walks out the door and starts running, screaming her head off.\n\n"""Five minutes,"""  Salvucci says. """That's all we give her."""\n\nMeat nods. Her footsteps (and screams) trail away.\n\nAfter three minutes Salvucci says """She's had enough time. Let's go."""\n\nThe three of you run down the hall to sickbay. She's inside, screwing a hose onto a black machine of some sort. She looks up. """I told you to give me mor--"""\n\nShe's interrupted by Markie's descent from the ventilation shaft onto the examination table. She growls at all of you. A giant purple claw has sprouted out of her missing arm. The other arm is rotting, like the rest of her body.\n\n"""Prettyprettyprettypretty."""\n\nOut of the corner of your eye, you see the cauterizing saw on the table next to the bed. \n\n1.[[Attack with the saw.]]\n2.[[Attack with your gun.]]"
"""She was.""","“She’ll be honored when we get back, along with Sergeant Benson.”\n\n“And Ben,” Strauss says suddenly, sharply.\n\n“Yes,” Salvucci answers. “And Ben.”\n\nThe two of them descend into uncomfortable silence; Strauss looking at her feet, Salvucci at the viewport. You feel awkward standing there, so you wander away.\n\n1. [[Go to sleep.]]\n"
"Search for Neil.","You take Meat's pistol and proceed down the hall until you reach the cockpit. The door is unlocked. You step through.\n\nBoth Neil and Salvucci are there peering over the main console. They turn when they hear you enter.\n\n"""Julia?""" Neil says, his eyes staring at the blood on your uniform.\n\n1. [[Kill them both.]]\n2. [[Take a bullet to the brain.]]"
"""Come on. Let's just go.""","“Quite right. Let’s go,” Strauss says, turning to leave.\n\n“What a bitch,” Neil mutters.\n\n“If you have something to say to me, you should say it aloud, pilot."""\n\n“Um…I said ‘What’s going on?’ Can somebody bring me up to speed?”\n\n1.[["""Ben's dead too."""]]\n"
"""We should get to Neil.""",""""Yeah, he might stick his head out after all that noise. Damn it, why don't we have walkies?"""\n\n"""We'll get them after we get Neil,""" Salvucci says.\n\nThe three of you leave behind the bodies of your comrades and make your way to the cockpit.\n\nYou breathe a sigh of relief when you see the door's still shut. Meat knocks on the door.\n\nFrom within: """Password?"""\n\n"""Come on, Neil. Knock that shit off."""\n\nAgain, louder: """Password?"""\n\nMeat sighs. """Ocelot."""\n\nThe door slides open, and Neil's boyish face is there to greet you. """Heard gunshots. You guys killin' things out here?"""\n\nSalvucci cuts to the chase. """Doctor Strauss, Ben, and Markie are dead. Whatever killed them is still on the ship, dressed in Markie's skin."""\n\nNeil looks at you all from left to right. """You guys are fucking with me, right?"""\n\n"""Does it look like we're yanking your chain, Neil?""" Meat growls, pointing to his gore-covered boot.\n\nHe gulps. """No, I guess not. So what happens now?"""\n\n"""We fucking kill it,""" Meat says.\n\n"""Well, yeah, but how?"""\n\n1.[["""We search the vents."""]]\n2. [["""We lure it out into the open."""]]\n\n\n"
"Go to sleep","It’s as though no time passes between the moment the darkness falls over you to when you open your eyes again and see ten soldiers standing over you, peering down, each of them equipped with assault rifles.\n\n“Come on, lieutenant,” one of them says, lifting you to your feet. You see Meat being held up by two soldiers. He’s grinning like a fool.\n\n“We did it,” his eyes say.\n\nThe troops escort you both to your own personal rooms where you’re served cheap steak and soda pop. It all tastes superb.\n\nLater, you and Meat are interviewed about the incident aboard the Speedwell. Security footage corroborates your testimonies. \n\nYou stay in your room for a week, feeling shackled and hoping that the military doesn’t eliminate you because of secrets you shouldn’t know. You and Meat are then taken to meet a general and his staff. You tell them your story. The old man nods and thanks you for your bravery.\n\nAnother day goes by and then, finally, you are released by the staff into the world. The familiar cityscape of New Austin is a welcome sight.\n\n“What now?” Meat asks, turning to you.\n\n1.[[“Get a drink.”]]\n2.[[Go home.]]\n\n"
"""Let's get on with this then.""","The groups go their separate ways; you hike down the cliff with Markie. It takes the larger portion of an hour to reach your tunnel. You step inside.\n\n"""Let's turn our lights on,""" Markie says quietly.\n\nYou both tell your suits to turn on your light attachments. Yours flickers for a moment before shooting a cone of light from your chest compartment.\n\nOn the Head Up Display (HUD) of your helmet, you can see the heartbeat monitors of everyone in your squad. Yours is going a little faster than normal and, knowing that everyone else can see that, you feel a little embarrassed.\n\nYou proceed through the cave.\n\n"""These caverns are massive. This one seems to just go on and on."""\n\n1.[["""What made them?"""]]\n"
"""Don't strain yourself; I don't want to be scooping you off the ground while I'm trying to shoot something.""","“Don't worry about me, Zoe. I can take care of myself,""" she snaps.\n\nThe two of you proceed down the main hallway. The silence is heavy, and Strauss seems to be deep in her own thoughts.\n\n1.[[“What’s waiting for you back on Mars?"""]]\n2.[["""What’s up with you and Meat?"""]]"
"""Shhh. I got it, Neil. Just rest.""","“Good. Give me your gun and turn the gas on before you leave.”\n\n“There’s no way out except through the front.”\n\n“Vent,” he says, pointing at a vent near one of the stoves. “…Gotta crawl fast. I’ll give you as much time as I can.”\n\nA clanging at the door. Whatever was inside Markie, was now trying to get in the kitchen.\n\n“This ain’t fucking right, man. It’s not right at all.”\n\n“Just give me your damn gun, dude.” He coughs. Meat, with reluctance, takes the pistol from his holster and sticks it in Neil’s hand. He then goes from stove to stove, turning on the gas.\n\nAnother bang at the door. The tip of a tentacle pierces the door and writhes wildly about, slapping a nearby wall.\n\n“Go,” Neil says, fighting to stay conscious.\n\n1.[["""God damn it. I'm so sorry, Neil."""]]\n2. [[Say nothing to him.]]\n"
"Get drinks with Meat.","“I hear that!”\n\nThe two of you travel by cab to the nearest bar and order your weight in whiskey shots. You laugh as you reminisce about good times with the crew, then you cry as you mourn the tragedy of their deaths. And then comes the silence where you both sit, staring at the table, saying nothing, just drinking as you come to grips with the fact that you’re both alive.\n\n“I should get home,” Meat says. “Rhonda’s waiting. Give me a call if you need anything, okay?”\n\n1.[["""You do as well."""]]"
"""Where on the ship did you look?""","“Everywhere,” Meat says before swallowing a chip. “Engineering, the cafeteria, the cryo room. We checked every nook and cranny. My only guess is that they’re in the vents.”\n\n“This is some fucked up shit,” Neil says.\n\n“Eloquent as always, pilot,""" Strauss snaps.\n\n“We should move shop,” Meat says after a moment. “This facility has two doors. I don’t like that. Captain and I were talking; the common room is more safe and it’s closer to the cafeteria. We can make supply runs.”\n\n“…while we—what? Wait for the creature to die?” Strauss asks.\n\n“That’s the plan. We stay safe, let it starve.”\n\n“And what if it can wait longer than us? What if that’s part of the thing’s plan? Wait till we get sick and hungry enough for it to overpower us. Did you even bother thinking about the logistics of that move? Cryosleep is part of the ship’s travel. We don’t have enough food on board to support us until we reach earth. We have maybe a month at the most before we run out. Then what?”\n\n“I don’t know, okay? I hear a lot of criticism but I don’t hear you contributing anything else, doctor.”\n\nStrauss scowled. “That’s because I’m trying to prevent you from leading us into a disaster.”\n\n“Can it, the both of you,” Salvucci commands. “Travis is right as far as safety precautions go. The common room will be easier to forify and protect than this place. We can worry about long term plans once we get set up there. Doc, you and Neil grab whatever supplies you think we might need from in here. Travis, you and Zoe make a trip to the cafeteria, bag some grub, meet us in the common room. Be. Careful.”\n\n“Yeah, boss. Got it,” Meat says. “Come on, Zoe.”\n\nThe two of you leave as Strauss, Neil, and Salvucci retrieve medical supplies.\t\n\n“You and the captain should have put a round in her when you found her,” Meat says as you walk toward the cafeteria.\n\n1.[["""We can't turn on each other, man."""]]\n2.[["""You and her are gonna get us all killed if you keep bickering."""]]\n3.[["""Tempting. It was very, very tempting."""]]\n"
