incoming,text
"""See you on Mars.""","You slide into your chamber and the hatch closes. You quickly fall into slumber. When you wake up, you're surounded by soldiers. One of them, a corporal, is saying something but his words are soundless. He takes you by the arm and guides you up from the pod.\n\nFrom there, you, the captain, and Meat are transported to the military outpost in New Austin. You are all given private rooms and access to nearly anything you could want. You order a steak on the first night and it's delicious.\n\nJust as Meat said, men in suits come and interview you about your experiences on the Speedwell. You answer their questions in as much detail as you can. They thank you for your time and promise you will be released soon.\n\n""Soon"" turns out to be three days later. You, Meat, and Salvucci meet on the base and request a transport to the nearest bar. There, you all drink in almost complete silence, only uttering the name of the lost from time to time.\n\nYou all take seperate cabs home. When you reach your house in the suburbs, you pass your mailbox but decide to check it later. It's only when you swipe your card against the door's reader and hear it unlock that you feel as though you are truly safe. Inside, you shut the door and hang up your coat.\n\nYou go into the living room and sit on the couch. You do nothing but stare at the wall for hours, in a trance of sorts. You rub you finger up and down one of the cushions of your couch. You are alive to do this, but you're not sure you're thankful for that.\n\nYou begin to see a therapist. You make progress--according to him, anyway. You never really shake the memories of your time aboard the Speedwell, but you're able to cope with them.\n\nThat's more than can be said for Captain Salvucci, who eats a bullet on the third anniversary of your return to Mars. You don't go to the funeral.\n\nYou and Meat stay in contact but the emails you send one another are largely going through the motions bullshit. You never send a word to one another that is true. Your failure to connect with him is indicative of your relationship with the rest of humankind. You never marry or even begin what you're comfortable calling a relationship with anyone. For the first ten years or so, this bothers you but you slowly grow comfortable with this new you.\n\nYou become a writer. Your sci-fi erotica, written under a pseudonym, sells well enough for you to live comfortably by yourself and away from everyone. You're mostly happy, but sometimes there's a thought that strikes at you like a whip: you are completely alone.\n\nThe End"
"""Sure, Ryan.""","""Seriously though, I wonder if we’ll find anything down here. I still think it’s erosion. I mean, sure, these tunnels are uh pretty deep, I guess, but erosion can do that, right? Erosion. Yeah.""\n\nYou continue on, the darkness before you giving way to only more darkness. Your suit tells you that twenty minutes have passed, but it feels like an age. Ryan’s chatter isn’t helping.\n\n""Hey, has Markie talked you about me at all? Actually, better question: do you know if she’s dating anyone? I mean, back on Mars.""\n\n1.[[""Sounds like a question you should ask her.""]]\n2.[[""Why are you such a fucking horndog?""]]\n3.[[""Dude.""]]"
"""You're certain?""","He nods. ""Yeah. I mean, it’s probably running around the ship, growing stronger by the minute, y’ know?""\n\nNo one answers him. \n\nHe takes a breath. ""Okay, well, how are we going to do this?""\n\n""We’ll go to the cafeteria—big, open space.""\n\nYou all make your way to the cafeteria, eyes watching the walls and vents. The journey is a safe one. \n\nAll of you step into the cafeteria.\n\nNeil looks out across the tables like a man looking at his own grave.\n\n""I always thought lunchrooms were kind of scary when I was a kids, ‘cause of the bullies and all. Never thought I’d die in one, though.""\n\n""You’ll be fine,"" Meat says. ""We’ll be in the other room. You’re gonna stay in here and use your walkie.""\n\n""To do what?""\n\n""Beg for help,"" Strauss says. ""Cry. Be bait.""\n\n""How’s it gonna hear that?""\n\n""Marki—what used to be Markie has a walkie clipped to her belt,"" Meat says.\n\n""And if she thinks it’s a trap?""\n\n""Then we come up with another plan. It’s animalistic though. I doubt it’ll pass up wounded prey,"" Strauss answers.\n\n""Gee thanks.""\n\n""You'll be fine,"" Meat says as the three of you make your way to the kitchen door.\n\n""I can’t believe this shit.""\n\nYou, Meat, and Strauss step into the kitchen and move away from the door. He turns to you. ""Make sure you have your gun ready, okay? I don’t want Neil to get eaten because we ran dry.""\n\nYou check your pistol to make sure it has a full clip and nod. You all sit silently and listen to Neil in the other room. ""Please help me,"" you hear him beg. ""I can’t find you guys.""\n\nThis goes on for 20 whole minutes, Neil’s acting growing steadily worse. ""I fucking hurt my leg,"" he whimpers.\n\n""A thespian, he is not,"" Strauss says.\n\n""Just let the boy work,"" Meat replies, though it’s clear he’s getting tired of this as well.\n\n""Oh fuck,"" Neil says.\n\n1.[[Answer Neil.]]\n"
"""We draw it out.""","""Okay, with what bait?"" Neil asks.\n\nYou and Meat look at Neil.\n\n""Oh,"" he says, getting it. ""Well fuck that.""\n\n1.[[""Man up already!""]]\n\n"
"""Get a drink.""","""I hear that.""\n\nThe two of you travel by cab to the nearest bar and order your weight in whiskey shots. You laugh as you reminisce about good times with the crew, then you cry as you mourn the tragedy of their deaths. And then comes the silence where you both sit, staring at the table, just drinking as you grapple with the fact that you’re both alive.\n\n""I should get home,"" Meat says. ""Rhonda’s waiting. Give me a call if you need anything, okay?""\n\n1.[[""You too.""]]\n2. [[Nod at him.]]\n"
"Starve.","You can't bring yourself to eat the body of your friend. Instead, you drag his corpse to the bunkroom and close him in so you don't have to look at or smell his corpse.\n\nYou're not far behind him. When it's time for you to go, you climb atop one of the tables and close your eyes. You wake up once, twice, but not the third time. Your sleep is endless.\n\n\nThe End\n"
"Go on home.","""Right. I understand."" She doesn't meet your eyes.\n\nThe cabbie drops you off first at your home in the suburbs.\n""Zoe,"" Strauss says as you get out of the car. ""Take care, okay?""\n\n1.[[""Yeah. You too, doc.""]]\n2.[[Simply nod.]]\n"
"""Yeah.""","""Damn it. Can't do anything about it now but, fuck, they're dead. And they don't have to be.""\n\nHe runs his hand over his face to calm himself. ""What should we do now?""\n\n1.[[""We sleep.""]]\n"
"""What happened?""","""The infection spread,"" Strauss explains.\n\n""What fucking infection?"" Meat interjects.\n\nStrauss turns her cold gaze onto him. ""I don’t know precisely what is in her body, Travis. What I do know is that once I amputated her arm, it lunged at my throat.""\n\n""Bullshit.""\n\n""No, it’s…it’s…true,"" Ben stammers. ""It’s over there. Look.""\n\nThere, lying on the ground, is a black arm with shriveled fingers caked in yellow ooze. You can barely make out three bullet holes.\n\n""Lenore says that Ben saved her life by putting it down,"" Salvucci says.\n\n1.[[""That’s good and all, but what about Markie?""]]\n2.[[""Nice job, Ben.""]]\n"
"Begin","The homeworld is nothing like you thought it would be. The landscape is black as tar and the temperature readings make you thankful for the air conditioning in your suit.\n\nThe crater, the reason for your journey, is dead ahead, a half mile in the distance. You don't mind the trek; this is a far cry from the 35 million miles you and your crew had to traverse for two months.\n\nWhat a long way you’ve come, you muse. But what is an ending but the beginning of another journey, wrote…who wrote that? You wrack your brain for an answer. The answer is just outside the limits of your consciousness, floating. You reach for it, grasp its tail, and then—\n\nSergeant Ryan Benson turns around to look at you.\n\n1.[[""Julia,"" he says.]]\n2.[[""Zoe,"" he says.]]\n\n"
"Don't die yet.","The gunshot echos throughout the hallway. Salvucci slumps against the wall with a bullet in his temple. Smoke drifts upward from the barrel of your pistol.\n\n""God damn it!"" Neil screams. ""Why did he make us do that? It's all gone to shit!""\n\n1.[[""Screaming isn't going to get us anywhere.""]]\n2. [[Shoot Neil too.]]\n"
"Join the creatures.","You awaken in sickbay. Meat is standing over you, a relieved expression on his face. You realize your holster's empty; your pistol is gone.\n\nHe's armed. You feel the warmth of your own body. Something's happening inside.\n\n""You okay, Zoe?""\n\n1. [[Murder Meat.]]"
"""Oedipa.""","""While I appreciate your clever literary reference, that is not, in fact, the password.""\n\nStrauss slams the fist of her unwounded arm against the door.\n\n""Listen here, you little shit. You open this door right now or so help me I’ll put you to sleep, slather whatever honey we have left in the cafeteria on your testicles, and we’ll use you as bait for that fucking monster.""\n\nThe door slides open. Neil’s face, boyish as ever, awaits you and Strauss. He is unharmed.\n\n""It eats honey?""\n\n""I don’t think I’ll ever be able to fathom the depths of your stupidity, pilot.""\n\nNeil frowns; he seems genuinely hurt by the remark.\n\n1.[[""Come on. Let's just go.""]]\n2.[[""Stop dicking around, Neil.""]]\n3.[[""Don't be such a bitch, Strauss.""]]"
"""What, no foam finger for me, pilot?""","""Ah, she's funny, Meat! I forgot how funny she was!"" he yells. Meat, grinning, shushes him.\n\n""Oh, am I too loud?""\n\nSalvucci soon arrives. Everyone, including you, buys each other rounds until you're all bloated and sick and green.\n\nOutside, you vomit in the street while you wait for a cab.\n\n""I'll...I'll get my car later,"" Meat says.\n\nSomehow you all manage to tell the cabbie your respective addresses. You stumble out of the cab at your house and tell the boys you'll call them later.\n\n""Bionic woman!"" Neil shrieks as the cab takes off.\n\nYour house, it turns out, looks the same as it did before you left on your mission. You take two steps into the living room and fall onto the couch. You grip it with your fingers and, face pressed into the cushions, laugh and laugh and laugh.\n\nYou are home. You are alive and you are home. The military sticks you with an analyst job. Though it's quite boring, there's no danger of getting your head chewed off, so ultimately you're fine with it.\n\nSome years pass. You meet a lovely woman named Michelle at work. She asks you out to dinner. You like each other well enough, so you begin to date. Your relationship is a comfortable one that, though emotionally satisfying, often leaves you yearning for excitement.\n\nYour life is quiet, peaceful. You still meet up with Salvucci, Neil, and Meat from time to time at the bar. They like Michelle.\n\nOne night, Meat takes you aside. ""They're nuking earth.""\n\n1. [[""Say what?""]]"
"""We’ve got to go!""","""Meet us at the center of the crater!"" Markie yells over the comm.\n\nYou look at Ryan’s heart monitor; he’s about to flatline. That’s when you hear it: the roar from the black.\n\nYou have a single bullet left.\n\n1. [[Shoot the beast.]]\n2. [[Put Ryan out of his misery.]]\n3. [[Run!]]\n"
"""Don't follow me.""","You hear him call your name as you turn and begin your sprint down the hall.\n\nIdiot, it says. We will win anyway. I offered you evolution, wretch.\n\nBlood drips from your nose. There's a pain in your stomach. You have to hurry.\n\nYou reach the hanger within a minute and seal the door behind you. \n\nYou approach the hanger door and place your hand over the release button. Your legs go numb and you fall to the floor, hand still held against the button. You press it and close your eyes. There's a whoosing sound as air is sucked past you, stinging your cheeks.\n\nThe first thing you feel is the cold. You open your eyes to see the Speedwell in all its glory as you drift away. The thing in your brain screams in anger and despair, but another voice cuts through. ""Just let go,"" Markie says, her voice free of malice and madness.\n\nYou turn away from your ship and peer out across the ocean of [[stars]] to gaze at the sun in the far distance. It's quite pleasant from afar.\n\nYou take her advice.\n\nThe End\n"
"""Are you really going to take her arm off?""","She frowns. ""Protocol states that any possibility of extraterrestrial infection must be removed with prejudice. We don’t know what ungodliness is brewing in that bite, so, yes, I am going to take off her arm. Now stay and watch, or leave us to our work. I don’t care either way.""\n\nYou can’t bear to watch the doctor dismember your comrade, so you leave.\n\nYou’re now standing in the hallway outside of sickbay.\n\n1.[[You go to the mess hall for a bite to eat.]]\n"
"Save Meat.","The hail of bullets clip the tentacle above Meat. It falls to the floor, but the beast itself is unfazed. Meat scrambles over to you.\n\n""We’ve got to go now.""\n\nYou look to Strauss. She’s crying as she’s pulled toward the monster’s face, its mouth stretching to accommodate her head.\n\nYou and Meat run past the monster. As you run, you see Strauss’s face being pressed against all the jagged teeth. You’re turning the corner in the hallway when you hear a sickening snap.\n\n""Keep running! Don’t look back!""\n\nYou both run until Meat, out of breath, stops. You fall to the ground, back against the wall.\n\n""She didn’t deserve to die like that,"" Meat says aloud. ""I didn’t fucking like her, but nobody deserves to go like that.""\n\n1.[[""It was you or her.""]]\n2.[[""No, she didn’t.""]]\n"
"Pair off with Ryan.","""In that case, I’m with Meat. Both groups will hike down the wall and take their respective tunnels. We’ve got the third one on the right,"" she says, pointing. ""You guys take the one over there.""\n\n1.[[""This is kind of a shitty idea.""]]\n2.[[""Aye.""]]"
"""The fuck you think I'm holding up?""","""Yeah, yeah, cut the tough bitch act and level with me: You think we got a chance against this thing? Whatever it is.""\n\nNeil leans in as well, clearly interested in your response.\n\n1.[[""Yeah. We just need to flush it out and kill it…somehow.""]]\n2.[[""I have no idea, guys.""]]\n3.[[""We're utterly fucked.""]]\n\n"
"""To die among the stars? No thanks.""","""What? No, of course not. I'm sending you back to the start, back to Earth with your memory wiped. Give you another shot. Maybe you'll make it out alive this time. Consider it...a reward for your selflessness, I guess.""\n\n1.[[""Let's say I believe you and that this isn't all some dying dream. What's to prevent me from making the same mistakes and ending up back here again?""]]"
"Let him get it out of his system.","He stops punching the wall after a while. Blood drips from his fingers. He breathes heavily.\n\n""He’s dead…because of us.""\n\n1. [[""Yeah? Well, let's make it fucking count.""]]\n2. [[""That's bullshit and you know it.""]]"
"""Yes, Markie I know what an earthworm is.""","""All right! Just checking. Creatures of the homeworld aren't exactly common knowled--did you hear something?""\n\nYou did. \n\nMarkie slowly pulls out her pistol. ""Just in case.""\n\nSuddenly you hear a high pitched whine from the darkness that sends a shiver down your spine. ""Guys, we're not alone,"" Markie says into her comm.\n\n""What's that?"" you hear Ryan say over your comm.\n\n""There's something in here with us.""\n\nShe nods at you and you both slowly back away. You pull out your pistol.\n\n""What is it?"" Meat asks.\n\n""No idea. Whatever it is, we're in its territory. I'm inclined to think we should leave it alone. Let's head back to the ship.""\n\nThe whine again. You focus your eyes and see something moving in the dark.\n\nMarkie sees it as well. ""Oh god, there's too many of them. Fall back!""\n\nShe fires a single shot. The flash of light reveals that the creature isn't one thing, but many things, with feelers and sharp teeth.\n\nThey rush toward you, hundreds of them.\n\n1.[[Shoot the creatures.]]\n2.[[Retreat with Markie.]]"
"""I’m sorry.""","Neil nods at you one last time. You make your way to the vent where Meat has just finished prying off the cover. The gas is thick in the air, making you slightly dizzy.\n\n""Tight fit,"" he says. ""I’ll go first so I can remove the next cover.""\n\nStrauss follows Meat. You look back to see that multiple tentacles have penetrated the door. Neil is pointing the pistol in the air and is breathing hard.\n\nYou force down the feeling of despair in your stomach and crawl through the vent. When you catch up to Strauss and Meat, he’s already kicking a cover.\n\n""Almost got it!"" With one last kick, the cover comes free. Meat grabs Strauss and pulls her through.You emerge into the hallway just in time to feel the ship shake violently.\n\nMeat slams his fist into the wall over and over. Strauss looks on sadly.\n\n1. [[Touch his shoulder.]]\n2. [[Do nothing.]]"
"Approve of Alex.","You and the bride-to-be get along well. She proves to be invaluable emotional support after Jack dies from a stroke.\nShortly after the funeral, Meat comes to visit and stays a couple of weeks.\n\nHe’s bald and uses a cane because of a bum leg. You watch reruns of sitcoms and play chess. You talk of your loved ones and then, unexpectedly, he brings it up.\n\n""Do you ever think of them? The crew?""\n\n1.[[""I do.""]]\n2.[[""I don't.""]]\n3.[[""What's the point?""]]"
"""He's dead, Meat.""","""Shit. All right, let’s get her aboard.""\n\nYou and Meat help Markie to the ship’s elevator. Meat enters a combination on the keypad and the door slides open. Inside the elevator, as you ride up, all three of you remove your helmets. You notice for the first time that your face is drenched in sweat.\n\nA ding. The door opens. Captain Jonas Salvucci, an older, muscular man with little patience of tomfoolery, awaits you—his hand wrapped around the pistol in his holster. He takes his hand away from the gun when he sees there’s no threat.\n\n""Get her to sickbay.""\n\nYou nod and help Markie through the hallway of the ship. Behind you, you can hear Salvucci interrogating Meat.\n\n""What happened to Ryan?""\n\n""He's dead, cap. Something got him.""\n\n""Hell, Travis. What did you find down there?""\n\nWhen you get to sickbay, both Lenore Strauss, the doctor, and her geeky assistant Ben are prepping the examination table.\n\n""Where’s she wounded?"" Lenore asks, as you help a woozy Markie out of her suit.  You glare at Ben as he gawks at her well-toned body. He smiles sheepishly and looks away, cheeks burning red with shame. Markie’s drenched in sweat; she stares around wildly as Lenore straps her in. Strauss examines the bite: it’s just above the elbow, an inflamed bulging of the skin.\n\n""And I was young and we were running,"" Markie rambles, ""eyes bouncing up and down the shore while the sun cooked the corpses of washed up jellyfish.""\n\nYou turn to Lenore, who’s prepping some kind of tool.\n\n1.[[""What the hell is she saying?""]]"
"""I don’t know, you fucking horndog.""","""Right. Sorry. Dumb question,"" he says sheepishly. ""Kind of awkward to put you in that position anyway. I was just—""\n\nA blur of blue darts across your light. You raise your pistol. \n\nRyan looks over his back and then at you.\n\n""What is it?""\n\n1.[[""I saw something.""]]\n2.[[""Get out of the way.""]]\n3.[[""MOVE!""]]\n"
"""Sure, why not?""","""Thanks,"" she says quietly. You get a cab and tell him to take you to the nearest bar. There, the two of you sit in silence for at least an hour, sipping your drinks. Finally, Strauss speaks.\n\n""I killed the captain. I let Ben die.""\n\n1.[[""Yeah. You did.""]]\n2.[[""You're alive, doctor. Isn't that what counts?""]]"
"""What are you going to do when we get back?""","She smiles sadly. ""I don't even care at this point. Maybe retire? I have enough money...I don't know. Just no more space for me.""\n\n""I hear that,"" Meat says as he and Salvucci enter the room. ""No more fucking space EVER.""\n\n""Command is going to decide that, I'm afraid,"" Salvucci says, stepping in front of his pod.\n\n""If command thinks they're getting my ass back on a boat like this, they can go fuck themselves.""\n\n""I'll pass along the message when we get back."" He turns to Strauss. ""Are you okay, doctor?""\n\n""Yes, I'll be fine. Just ready for this to all be over.""\n\n""Well, let's get on our way then.""\n\nYou get in your pod and lie down. ""Sweet dreams everyone,"" you hear Meat say right before your chamber shuts itself. You close eyes. The world gets even darker.\n\nWhen you awaken, you find yourself being assisted by a corporal. He takes you by the arm and guides you up from the pod.\n\nFrom there, you, the captain, Meat, and Strauss are transported to the military outpost in New Texas. You are all given private rooms and access to nearly anything you could want. You order a steak on the first night. It's delicious.\n\nMen in suits come and interview you about your experiences on the Speedwell. You answer their questions in as much detail as you can. They thank you for your time and promise you will be released soon.\n\n""Soon"" turns out to be three days later. You, Meat, Salvucci, and Strauss meet on the base and request a transport to the nearest bar. There, you all drink in merriment, celebrating your survival, though you allow yourselves to mournfully drink a round and say small eulogies for the dead: Ben, Markie, Neil, Ryan.\n\nWhen all of you are finished, you share a cab that drops you off at your respective addresses. You're the first. Your comrades tell you to call them soon just to check in. Inside your small house in the suburbs, you finally allow yourself a good cry. Not for the dead. Not for any reason at all, in particular, except that it's been inside you for so long, struggling to get out.\n\nA week passes. You're relocated to analyst position on the military base in New Austin. You hear that Strauss is working at a military hospital in New Memphis. You never talk to her, really, but Salvucci and Meat send you emails all the time. Both of them have been reassigned to on-base positions; Meat's an instructor, and Salvucci can't tell you what he does. You imagine it has something to do with what you found on earth.\n\nYears pass. You never marry or have children, but you're never alone. Girlfriends come and go, at a rate of about one every five years. You become attached to them all and break down in sobs when each one leaves. You never tell any of your lovers about your experience aboard the Speedwell.\n\nYou and Meat become close. You meet twice a week for lunch. On Wednesdays, you watch sitcoms; on fridays, there's salsa night downtown. You get a dog. \n\nThis is your existence and it proceeds one day after another.\n\nInevitably, you grow old. Salvucci dies first. You and Meat attend his funeral. You and Meat take bets on who's next; turns out it's you.\n\nYou pass away one night in your sleep, your dog curled up behind you with his snout against your back, the poor creature peacefully unaware of your endless slumber.\n\nThe End\n\n\n"
"Shoot the switch.","Meat fires. Strauss' head falls back and her limbs go limp. Markie turns to see all of you. She growls and drops Strauss.\n\nThat's when you fire a single shot at the control panel. Upon impact the door seperating the hanger from the rest of the ship comes down, seperating you from the hanger. Alarms shriek. You watch from the door's window as both Strauss' corpse and the creature are sucked out into space. The two forms drift away until they're dots, inseparable from distant stars.\n\nNone of you give a cheer or breathe a sigh of relief, however. There's a sense of shame that hangs over all of you, an awareness of your cowardice. You played it safe so that one of your crewmates could sacrafice herself.\n\nThe auto-close kicks in and the hanger door shuts itself. The alarms cease their cries.\n\n""We should go check Neil's console,"" Meat says.\n\nThe three of you silently make your way to the cockpit. Inside, you find the autopilot already engaged. The console is covered in blood; the pilot's corpse is behind it.\n\n""He knew he wasn't going to make it,"" Meat says bitterly. ""Setting the autopilot must have been the last thing he did. Another goddamn hero.""\n\n""Everyone who died here will be honored when we get home,"" Salvucci says. \n\n""Oh good, because medals were really what I was concerned about,"" Meat says. ""I'm gonna go check the rest of the ship make sure nothing will snack on us while we sleep.""\n\n""I'll go with you,"" Salvucci says. ""Julia, go make sure the cryopods are ready.""\n\n1. [[Ready the cryopods.]]\n\n"
"""What made them?""","""Well, if I had to make a guess, I'd say a giant-ass earth worm...you know what an earth worm is, right?""\n\n1.[[""A what?""]]\n2.[[""Yes. I know what a goddamn earthworm is.""]]\n"
"""Ryan's chum.""","""Meet us at the center of the crater!"" Markie yells over the comm.\n\nYou look at Ryan’s heart monitor: he’s about to flatline.\n \nThat’s when you hear the roar from the black.\n\nYou have a single bullet left.\n\n1. [[End Ryan's pain.]]\n2. [[Shoot the monster.]]"
