incoming,text
"""What’s up with you and Meat anyway?""","""He's a fool. I'm not. End of story."" The rest of the journey is silent.\n\nThe two of you approach the cockpit.\n\nYou knock on the door.\n\nNeil’s muffled voice comes from beyond the door: ""Password?""\n\n""Open the fucking door, pilot!""\n\n1.[[""Let’s just go.""]]\n2.[["" Doctor Strauss is right; stop dicking around, Neil.""]]\n3.[[""Take it easy on him.""]]"
"""Burn 'em.""","You follow Salvucci as he leaves the room. Before you step out you turn to Meat. \n\n1.[[""Don't get yourself killed.""]]\n2.[[""You sick bastard.""]]\n"
"""Let's say I believe you and that this isn't all some dying dream. What's to prevent me from making the same mistakes and ending up back here again?""","The young man turns to you. His face is young, boyish. He thinks for a second. Finally, he speaks. ""Nothing. There's no guarantee of anything. You just have to hope.""\n\n1. [[""This is bullshit. If you can send me back, why can't you just make it so we all get home safely?""]]\n2. [[""Gee thanks.""]]\n\n"
"Send someone to check on Neil.","""I'll go,"" Strauss says. ""Anything to get away from this moron.""\n\n""Be careful, sweetheart,"" says Meat. ""It'd be a shame for you to get your face bitten off.""\n\n""Here. Take this."" Salvucci hands her his pistol. She nearly drops it.\n\n""Thanks, captain.""\n\n""Be careful.""\n\nWithout another word, she disappears around the corner.\n\n1. [[Continue onward to the mess hall.]]"
"""What is it?""","""There are tunnels.""\n\nRyan turns. ""Come again?""\n\n""Tunnels. In the crater. The last reconnaissance team didn’t say anything about tunnels in their report.""\n\n""How long ago was that?""\n\n""Seven years. Give or take a month.""\n\n""Erosion. Boom.""\n\n1.[[""Shut up, Ryan.""]]\n2.[[""Erosion...right.""]]\n"
"""I don't.""","""Me neither,"" he says, not meeting your eyes. That’s all he says on the matter. The week passes. He leaves. His wife, Rhonda, calls you a month later to tell you he passed away in his sleep. You can’t make the funeral because traveling would worsen your ailing health even more.\n\nYou wait. You spend days watching old movies. You try to make your way through a collection of Christine Love’s works, but you keep losing your focus.\n\nDeath comes when you’re sitting in your loveseat watching a news report on a bridge being built in a neighboring county. It is a quick, painful tremor that starts in your chest and spreads out.\n\nAnd then the dark sets in;you never expected slipping away to be this easy.\n\nThe End\n"
"""Burn her just to be sure.""","Meat nods. Twenty minutes later he’s scavenged the supplies for another Molotov. \n\nBoth of you return to Strauss’ body. You watch silently as it burns.\n\n""We shouldn’t move the bodies,"" he says. ""Might make us sick or something. Be a fucking shame to die over a little infection at this point,"" he says, attempting to smile, but he can’t manage it. The will to smile or laugh has gone out of both of you. \n\nWhat future awaits you both now?\n\nYou both return to your cryo tubes and pop them open. They hiss and spew cold air on you.\n\n""Two months,"" he says as he stares at the tube, which you realize now looks very much like a coffin. ""Here’s hoping nothing eats us while we’re sleeping.""\n\nHe gets in his. You follow suit.\n\n""See you soon, kid.""\n\nYou press the button on the interior of the door and it slowly closes on your tube. You hear the seal clamp. A mist falls over your face.\n\nYou slowly closes your eyes and hope you wake up.\n\n1. [[Go to sleep]]\n"
"Take a bullet to the brain.","You can't kill them. You thought you could, but you're not strong enough. \n\n""Julia, put down the gun...please,""  Salvucci says, hand reaching toward you as he approaches.\n\n""Where's Meat?"" Neil asks.\n\n1. [[""I'm so sorry.""]]\n\n\n"
"""Watch your tone, Strauss. Getting real tired of your shit.""","Strauss says nothing.  You can’t help but notice Neil’s grin.\n\n""When are they supposed to be back?""\n\n""An hour from when we left,"" Strauss says.\n\n""How long ago was that?""\n\n""I don’t know. I’m a doctor, not a timekeeper.""\n\n""Sheesh. Well, okay, so what should we do to pass the time?""\n\n""Time’s going to pass regardless of what we do with it.""\n\n""Right. So you’re going to sulk over there in the corner. Fine.""\n\nHe turns to you. Zoe?""\n\n1.[[Play Rock, Paper, Scissors.]]\n2.[[Play Tic-Tac-Toe.]]\n3.[[Sulk in silence.]]"
