incoming,text
"""What happened, happened.""","""Let's go...let's go see Neil. Just to be sure.""\n\nIn the kitchen, you find the charred corpse of Neil. Meat stands over him and retrieves the broken pistol fragments from his hand.\n\n""You think we could have saved him—saved all of them--if we had made different choices?""\n\n1.[[""We're still breathing.""]]\n2.[[""I don't know, Meat. I don't want to know.""]]\n3.[[""We did our best.""]]\n\n"
"Retreat with Markie.","You both retreat. ""Neil,"" you hear Meat yell over the comm. ""Bring the Speedwell to the LZ. We need some fucking help here.""\n\n""Coming as fast I can,"" Neil says.\n\nYou run and run and run. You surge ahead of Markie and lose feeling in your legs, but somehow you keep going full speed anyway. Near the end, you swear that your heart is going to burst and that your lungs will catch on fire, but you eventually stumble out of the tunnel into the irradiated light of dusk.\n\nAcross the way, you see Meat running by himself. Ryan is nowhere to be seen. You’ve covered half the distance to Meat when, looking up, you see the Speedwell beginning its descent.\n\nYou're almost to him when you hear Markie scream. Turning, you see her fling one of those crab creatures across the ground.\n\n""Damn!"" she yells.\n\nMeat blasts the creature into pieces. The two of you rush over to her. She's holding her arm.\n\n""It got me,"" she says; there's fear in her voice. She turns to Meat. ""Where's Ryan?""\n\n""Goddamn fucking thing ate him. It ATE him.""\n\nMeat's answer fills you with cold. Ryan is dead. No one that close to you has ever died before. Your vision becomes unfocused. A slap on the arm brings you back.\n\n""We've got company, Julia. I need you here and now,"" Meat says, nodding at the mouth of the cave where the crab creatures are gathering. There must be thousands of them. Luckily, behind you the Speedwell is landing.\n\nMeat fires several shots at the crabs, but they don't seem to be leaving the cave anyway.\n\nYou and Meat help Markie to the ship’s elevator. Meat enters a combination on the keypad and the door slides open. Inside the elevator, as you ride up, all three of you remove your helmets. You notice for the first time that your face is drenched in sweat.\n\nA ding. The door opens. Captain Jonas Salvucci, an older, muscular man with little patience for tomfoolery, awaits you—his hand wrapped around the pistol in his holster.\n\nHe takes his hand away from the gun when he sees there’s no threat.\n\n""Get her to sickbay.""\n\nYou nod and help Markie through the hallway of the ship. Behind you, you can hear Salvucci interrogating Meat.\n\n""What happened to Ryan?""\n\n""He's dead, cap. Something got him.""\n\n""Hell, Travis. What did you find down there?""\n\nWhen you get to sickbay, both Lenore Strauss, the doctor, and her geeky assistant Ben are prepping the examination table.\n\n""Where’s she wounded?"" Lenore asks as you help a woozy Markie out of her suit. You glare at Ben as he gawks at her well-toned body. He smiles sheepishly and looks away, cheeks burning red with shame. Markie’s drenched in sweat; she looks around wildly while Lenore straps her in. \n\nShe examines the bite: it’s just above the elbow, an inflamed bulging of the skin.\n\n""And I was young and we were running,"" Markie rambles, ""eyes bouncing up and down the shore while the sun cooked the corpses of washed up jellyfish.""\n\nYou turn to Lenore; she's prepping some kind of tool.\n\n1.[[""What’s she saying?""]]\n2.[[""What is that?""]]\n"
"""Everybody cool?""","""Good question. Doctor?"" Salvucci says, turning to Strauss. She's red in the face, clearly panicked.\n\n""I don't know,"" she says. ""There's no way to know we're infected until we start seeing symptoms.""\n\n""Which would be...""\n\n""I don't know, Travis. From our brief encounter with Markie's transformation, I would be inclined to say that we would drop to the floor and start babbling nonsense while our bodies decayed, but she was bitten. If there was an airbone virus when that blob exploded, our transformations could be much more subtle. There's no way to know until whatever happens, happens.""\n\n""A comforting thought,"" Neil says.\n\n""The best thing we can do right now is...just wait. Maybe some of us get some shut eye and then rotate the guard.""\n\n""What are the guards looking out for, exactly?""\n\nStrauss looks at Meat and takes a breath. ""Symptoms. In case something goes wrong with one of the sleepers.""\n\nSalvucci nodded. ""We're all a bit tired. Meat, Zoe, doctor, you three rest first. Neil and I will keep watch.""\n\n""Make sure not to turn into boogeymen,"" Neil says as the three of you head toward the barracks.\n\n""If I do, I'll eat you first, little man,"" Meat replies.\n\n1. [[Sleep in the barracks]]"
"""We’re alive.""","""Yeah, that’s what counts, I guess. What now?""\n\n1.[[""We sleep.""]]\n"
"""We’re screwed, fellas.""","""I was worried you'd say something like that."" Meat sighs. ""Yeah, I guess I should focus some of my mental energy on figuring out how to kill it instead of wasting it on fucking checkers, huh?""\n\n""Make your move already, dude,"" says Neil, growing impatient.\n\n""Fine. Julia, we can talk strategy in a bit.""\n\nYou walk away.\n\n1. [[Talk to Salvucci and Strauss]]\n2. [[Go to sleep.]]\n"
"stars","Something feels different. The cold is gone. You're warm, in fact.\n\nYou open your eyes.\n\nYou are curled up on the floor of small room with a grey carpet and a fold-out couch.\n\nOn the other side of the room is a young man sitting at his desk, typing away at his computer. He is tall with short brown hair.\n\n1. [[""I'm alive.""]]\n2. [[""Where am I?""]]"
"""You monster.""","""I didn’t have a choice,"" she stutters.\n\n""There’s always a choice,"" Meat barks, stomping toward her.\n\n""It’s what he wanted!""\n\n""We could have saved him!""\n\n""No, you coul—"" Her declaration dies in her throat as Meat violently wraps his hands around her neck. ""You’d do the same to any of us, wouldn’t you?""\n\n""Travis…stop,"" Neil says.\n\n""No, she’d kill us all if it worked to her advantage, Neil. I don’t want someone like that behind us.""\n\nStrauss is getting red in the face.\n\n1.[[""Travis...let her go.""]]"
"""It’s not your fault, y’ know.""","""Wrong. Those three people were under my command. Their lives were in my hands. At the very least I made a decision that cost that boy his life. He wasn’t even 20 yet.""\n\nYou hear his voice break.\n\n1.[[""You made the sensible choice. It just wasn’t the right one. Don’t let it get to you.""]]\n2.[[""Regardless, don’t let this distract you. I need you here, not in mourning. Save that for later.""]]\n"
"Initiate you and Strauss' cryopods.","You head to the cryogenics room and boot up two pods. Strauss shows up an hour later smelling like smoke.\n\n""It's done.""\n\nShe takes off her glasses and places them on a table nearby.\n\n1. [[""Do you want to talk?""]]"
"""Not a thing.""","You snatch the gun from his holster and shoot him in the shin. He falls to the ground screaming in pain.\n\n""The fuck, Julia?!""\n\nYou back away from him, pistol aimed at his head.\n\n1.[[""Don't follow me.""]]\n2. [[Leave without a word.]]"
"Kill him first.","The gunshot echos throughout the hallway. Salvucci slumps against the wall with a bullet in his temple. Smoke drifts upward from the barrel of your pistol.\n\n""God damn it!"" Neil screams. ""Why did he make us do that?""\n\n1. [[""Screaming isn't going to get us anywhere, Neil.""]]\n2. [[Shoot him too.]]\n\n"
"""I'm sorry, Travis.""","""About what?""\n\nYou snatch the gun from his holster and shoot him in the shin. He falls to the ground screaming in pain.\n\n""The fuck, Julia?!""\n\nYou back away from him, pistol aimed at his head.\n\n1.[[""Don't follow me.""]]\n2. [[Leave without a word.]]"
"""Let her go.""","""Are you serious?"" he yells, hands clutching her throat still. She throws a weak punch at his arm. ""She killed him; she’ll kill us, too.""\n\n""Dude, just…stop. We’ll tell the authorities what she did when we get back. She'll rot in prison.""\n\nMeat considers this and then lets go of Strauss. She gasps for air. ""Insane…idiot!""\n\n""You shut your damn mouth. I’m a second away from adding your body to the pile.""\n\nMeat sets down his backpack and opens it up, pulling out the glass bottle, rag, and oil can. He gets to work as Strauss stumbles over to join you and Neil.\n\n""Thanks,"" she says, not turning to face you.\n\n1.[[""Don’t thank me.""]]\n2.[[""I should have let him kill you.""]]\n3.[[""You’re welcome.""]]\n\n\n"
"Murder Meat.","You sniff and then rub your eyes. The tears come quickly.\n\nMeat falls for it. ""Oh hey, hey, Zoe."" He hugs you.\n\nNow, the voice hisses.\n\nYou place your head against his neck. You hear the pumping of an artery. You smell blood. \n\nYou turn and savagely rip into his neck with a sickening bite. Meat's scream becomes a gurgle as you pull away, ripping away the skin and his cartoid.\n\nHe stumbles away fom you, hand pressed agaisnt his neck, but it's no good. He trips over a cable and falls back onto the floor.\n\nHe reaches toward you but then drops his arm. He's dead.\n\nNow, the voice says, the other two.\n\n1. [[Find Neil.]]\n"
"End Ryan's pain.","You take careful aim and fire a single shot that pierces Ryan's visor and kills him instantly. The squad vital monitor shrieks at you as he flatlines.\n\nThe beast roars again and then you catch a glimpse of the monster’s hideous, reptilian face as it darts out and closes its jaws around Ryan’s head. Like fingers plucking a grape from a vine, the beast rips out your squadmate’s head leaving a bloody stump. \n\nYou flee.\n\nLooking over your shoulder, you watch as what’s left of Ryan is pulled out of sight.\n\nYou run and run and run. You lose feeling in your legs but somehow keep going full speed anyway. Near the end, you swear that your heart is going to burst and that your lungs will catch on fire, but eventually you stumble out of the tunnel into the irradiated light of dusk.\n\nAcross the way, you can see Meat assisting a limping Markie. Behind them, you glimpse small purple mushroom shapes scuttling across the ground. You run toward your squadmates. You’ve covered half the distance when, looking up, you see the Speedwell descending.\n\nWhen you reach them, Meat hands Markie off to you and turns to fires several rounds at the crab creatures. He tags all of them except for one. \n\nYou watch helplessly as the little bastard leaps through the air and, with tentacles shooting out from its underbelly, wraps itself around Markie’s arm.\n\nShe screams in pain. You whip out your empty pistol and bash the monster’s dome inward. The creature lets go of her arm and falls to the ground, legs squiggling. Its agony is short-lived, as Meat puts three rounds into the soft underbelly.\n\n""Fucking fuck."" He kicks the crab.\n\nYou turn to Markie, who’s holding her arm. \n\n1.[[""Your suit's ripped.""]]"
"Touch his shoulder.","He stops punching the wall. Blood drips from his fingers. He breathes heavily.\n\n""He’s dead…because of us.""\n\n1.[[""I know. Now let’s make it count.""]]\n2.[[""Nobody could have predicted that.""]]\n"
"Shoot it!","You fire several rounds as well, tearing off her other arm. Still, the body convulses. You watch as Neil turns to run to the kitchen. He’s a foot away from the door when a grey tentacle shoots out of the body’s back and impales him through the chest. It whirls him about and throws him through the kitchen door.\n\n""Fuck it, run! Run!"" Meat yells. He drops the rifle and runs into the kitchen. You aren’t far behind, jumping over a low slash from the tentacle. Right before you step inside, you see another writhing tentacle erupt from her body.\n\nYou slam the door and turn around. Meat is looking over the bloody hole in Neil’s chest. Blood is dripping from the corner of Neil’s mouth. You hear another stretching sound follow by a splash outside. Another tentacle.\n\n""Fuck me, fuck fuck fuck,"" Meat says, his voice dripping with guilt. ""I’m so sorry.""\n\nNeil looks up at him. ""Not your fault, big man. Wasn’t fast enough…""\n\nHis wound looks deep.\n\nHe turns to you. ""Zo...Zoe, come here.""\n\nYou lean down.\n\n""Cockpit. Computer login is…"" he coughs up some blood. ""login is ‘K-O-N-A-M-I. Got it?""\n\n1.[[""Shhh. I got it, Neil. Just rest.""]]"
"""You won't find any sympathy with me. Do it yourself.""","""Very well,"" she says. She lifts the scalpel to her neck and pulls it across. She gasps as blood streams down neck. She falls to the floor and chokes.\n\nYou watch until she expires. You leave the room to find the captain and Neil in the hallway examining Meat's corpse.\n\nThey look at you. ""Where's Strauss?"" Salvucci demands.\n\n1.[[""She was infected. She killed Meat out of cowardice.""]]\n2.[[Take no chances: kill both of them.]]"
"""Neil and Markie are dead.""","""Shit. Make your way back to the hall.""\n\nYou do so. Meat and Salvucci are below you, waiting. Meat won't look you in the face.\n\n""Are you sure it's dead?"" Salvucci asks.\n\n1.[[""Yeah, they're not getting back up.""]]\n"
"""Let's get the fuck home, eh?""","""Yeah, let’s.""\n\nThe two of you walk back through the hallway leading to the hanger and then to the cockpit. The bodies of your crew are still there. Meat stares at them.\n\n""Do you think if we had made different choices, they'd still be alive?""\n\n1.[[""We're alive. What else matters?""]]\n2.[[""Meat, I don't know, okay?""]]\n"
"""We check out the vents.""","Salvucci nods. ""That's a viable plan. We'll all enter the ventilation and hunt it down.""\n\n""All of us?"" Neil asks.\n\n""Yes, pilot. All of us.""\n\n""Do I get, like, a weapon at least?""\n\n""Here."" Meat says, shoving his own pistol into Neil's hands.\n\n""Bro, I've never used one of these.""\n\n""Well, if it makes you feel better, it wouldn't help much anyway. Bitch is a bullet sponge.""\n\n""Oh good, you know for a minute there I thought I might actually have decent odds for survival.""\n\n""Quit bickering,"" Salvucci says sternly. ""We'll go for the vent in the central hallway. From there we can spread out and cover the whole ship.""\n\nYou all make your way to the central vent, located in the belly of the ship. Salvucci pushes a button on the wall; the vent shrieks open and down pops a ladder.\n\n""I'll go north. Travis, you're with me. Julia and Neil, you go south. We meet back here in twenty minutes. If you spot it, call for help.""\n\nYou watch as Meat and Salvucci ascend the ladder. You and Neil wait a minute and then go up. \n\nThe shaft is tight, but both of you manage to fit, with you at the front. You crawl slowly, pistol in hand.\n\n""You know,"" Neil says after you've been crawling for five minutes, ""I never thought I'd go out like this. I thought that it'd be from a heart attack...in a bathroom or something, nude on a tile floor, ass up in the air.""\n\n1.[[""Neil. Shut the fuck up.""]]\n2.[[""Oh do tell.""]]"
"""It wiggled a lot.""","""Helpful information,"" Strauss says.\n\n""Great. If it’s not dead, we’re fucked. All we got left is your pistol. I’m guessing you’re down to two clips.""\n\nYou pop the clip out of your pistol to show him it’s the last one.\n\n""Shit.""\n\n""We don’t know if it’s alive. If it is, we’ll improvise.""\n\n""Great, I wonder who’ll die next time thanks to our masterful improvisation skills.""\n\nStrauss says nothing. \n\nA few minutes later you reach the cockpit door. Ben’s body is still there, as are the burnt remains of the captain.\n\n""Well, that’s good, all things considered,"" says Meat. You notice that Strauss is deliberately looking away from Ben’s smashed skull.\n\nThe three of you step into the cockpit. You slam the door behind you.\n\n""Here’s the computer.""\n\nYou step over to the main console. A password screen greets you. You type in ""KONAMI.""\n\nThe screen changes to a selection of menus.\n\n""There’s the autopilot,"" says Strauss. She touches the screen and selects NEW AUSTIN.""\n\n""We done?"" Meat asks.\n\n""Yeah, I think we’re set.""\n\n""Good.""\n\nAll of you approach the door.\n\n""Now let’s get out of here before that fucking thing corn—"" \n\nA tentacle sweeps through the door as soon as it opens and brushes all of you aside with a mighty swing. You all going flying across the room. You slam into the viewport, cracking the glass, and then fall to the floor. Looking up you see the thing step into view: it’s monstrous, with a muscular human abdomen. \n\nThe thing’s face is distinctly unhuman with countless slitted eyes glaring at you. The monster’s mouth is a vortex of meat and sharp teeth. Four tentacles protrude from its back, each one moving like a rattlesnake.\n\n""No!"" you hear Strauss scream as one of the tentacles darts out and wraps itself around her neck. It lifts her into the air and pulls her toward its master. You turn to look at Meat who’s paralyzed with fear, watching one of the tentacles dance above him.\n\nYou reach for your pistol.\n\n1. [[Help Meat.]]\n2. [[Help Strauss.]]\n3. [[Leave them to die.]]"
"""I have faith.""","""Then that makes you an even bigger idiot than I thought you already were.""\n\n""When are they supposed to be back?"" Neil asks before you can reply to Strauss.\n\n""An hour from when we left,"" Strauss says.\n\n""How long ago was that?""\n\n""I don’t know. I’m a doctor, not a timekeeper.""\n\n""Sheesh. Well, okay, so what should we do to pass the time?""\n\n""Time’s going to pass regardless of what we do with it.""\n\n""Right. So you’re going to sulk over there in the corner. Fine.""\n\nHe turns to you. ""Julia?""\n\n1.\t[[Rock, Paper, Scissors]]\n2.\t[[Tic-Tac-Toe]]\n3.\t[[Also sulk in silence]]\n"
"""Yeah, so let's make it count.""","He doesn't meet your eyes. ""Whatever. We need...we need to get this boat moving again. He gave you a password, right? Let's hope that console has autopilot or some shit. Worry about that motherfucker then.""\n\nThe two of you make your way toward the cockpit.\n\nA few minutes later you reach the cockpit door. Ben’s body is still there, as are the burnt remains of the captain.\n""Well, that’s good, all things considered,"" says Meat. You step into the cockpit. The door slides shut behind you.\n\n""Here’s the computer.""\n\nYou step over to the main console. A password screen greets you. You type in ""KONAMI.""\n\nThe screen changes to a selection of menus.\n\n""Here we go: autopilot"" says Meat. He touches the screen and selects NEW AUSTIN. You head for the door.\n\n""Alright, good. We're set. Let's get the hell out of her--""\nA tentacle sweeps through the door as soon as it opens and brushes both of you aside with a mighty swing. \n\nYou slam into the viewport, cracking the glass, and then fall to the floor. Looking up, you see the thing step into view: it’s monstrous, with a greekly perfect human abdomen. The thing’s face is distinctly unhuman with countless, slitted eyes glaring at you. The monster’s mouth is a vortex of meat and sharp teeth. Four tentacles protrude from its back, each one moving like a rattle snake.\n\nYou turn to look at Meat. He's being lifted into the air by one of the tentacles. His face turns red; he's slowly being choked to death.\n\nYou reach for your pistol.\n\n1. [[Risk your life to save Meat.]]\n2. [[Leave Meat to die and save yourself.]]"
"""You're not really going to take her arm off, are you?""","She frowns. ""Protocol states that any possibility of extraterrestrial infection must be removed with prejudice. We don’t know what ungodliness is brewing in that bite, so, yes, I am going to take off her arm. Now stay and watch, or leave us to our work. I don’t care either way.""\n\nYou can’t bear to watch the doctor dismember your comrade, so you leave.\n\nYou’re now standing in the hallway outside of sickbay. Oddly enough, you're hungry.\n\n1. [[Go eat something.]]"
"""Ben's dead too.""","""What the fuck happened?""\n\n""If you must know,"" Strauss says, turning her head to glare at Neil, ""he saved me and I left him to die.""\n\nThe surprise and indignation in Neil’s voice fades. ""Oh.""\n\n""Yes. Now can we please just get back to sickbay?""\n\n""Sure. Sorry.""\n\n1.[[""Neil, stop talking.""]]\n2.[[""Harsh, doc. Harsh.""]]\n\n"
"""Are you okay?""","""Dead. He's dead,"" she says again.\n\nAbove you you hear the roar of the Speedwell's thruster as the ship lands. The sound frightens the fungal crabs back into their home.\n\nYou and Meat help Markie to the ship’s elevator. Meat enters a combination on the keypad and the door slides open.  \n\nInside the elevator, as you ride up, all three of you remove your helmets. You notice for the first time that your face is drenched in sweat.\n\nA ding. The door opens. Captain Jonas Salvucci, an older, muscular man with little patience of tomfoolery, awaits you—his hand wrapped around the pistol in his holster.\nHe takes his hand away from the gun when he sees there’s no threat.\n\n""Get her to sickbay.""\n\nYou nod and help Markie through the hallway of the ship. She's delerious now, stumbling. Behind you, you can hear Salvucci interrogating Meat.\n\n""What happened to Ryan?""\n\n""I dunno. I think the blood on Markie's suit isn't all hers, though.""\n\n""Damn it, Travis. What did you find down there?""\n\nWhen you get to sickbay, both Lenore Strauss, the doctor, and her geeky assistant Ben are prepping the examination table.\n\n""Where’s she wounded?"" Lenore asks, as you help a woozy Markie out of her suit.  \n\nYou glare at Ben as he gawks at her well-toned body. He smiles sheepishly and looks away, cheeks burning red with shame. Markie’s drenched in sweat; she stares around wildly as Lenore straps her in. She examines the bite; it’s just above the elbow, an inflamed bulging of the skin.\n\n""And I was young and we were running,"" Markie rambles, ""eyes bouncing up and down the shore while the sun cooked the corpses of washed up jellyfish.""\n\nYou turn to Lenore, who’s prepping some kind of tool.\n\n1.[[""What’s she saying?""]]\n2.[[""What is that?""]]"
"Shoot the creatures.","You fire several shots into the sea of creatures and even kill a few, but they still surge toward you.\n\n""What are you doing? Run!""\n\nYou both retreat. ""Neil,"" you hear Meat yell over the comm. ""Bring the Speedwell to the LZ. We need some fucking help here.""\n\n""Coming as fast I can,"" Neil says.\n\nYou run and run and run. You surge ahead of Markie and lose feeling in your legs, but somehow you keep going full speed anyway. Near the end, you swear that your heart is going to burst and that your lungs will catch on fire, but eventually you stumble out of the tunnel into the irradiated light of dusk.\n\nAcross the way, you see Meat running by himself. Ryan is nowhere to be seen. You’ve covered half the distance to Meat when, looking up, you see the Speedwell beginning its descent.\n\nYou're almost to him when you hear Markie scream. Turning, you see her fling one of those crab creatures across the ground.\n\n""Fuck!"" she yells.\n\nMeat blasts the creature into pieces. The two of you rush over to her. She's holding her arm.\n\n""It got me,"" she says; there's fear in her voice. She turns to Meat. ""Where's Ryan?""\n\n""Goddamn fucking thing ate him. It ATE him.""\n\nMeat's answer fills you with cold. Ryan is dead. No one that close to you has ever died before. Your vision becomes unfocused. \n\nA slap on the arm brings you back.\n\n""We've got company, Julia. I need you here and now,"" Meat says, nodding at the mouth of the cave where the crab creatures are gathering. There must be thousands of them. Luckily, behind you the Speedwell is landing.\n\nMeat fires several shots at the crabs, but they don't seem to be leaving the cave anyway.\n\nYou and Meat help Markie to the ship’s elevator. Meat enters a combination on the keypad and the door slides open. Inside the elevator, as you ride up, all three of you remove your helmets. You notice for the first time that your face is drenched in sweat.\n\nA ding. The door opens. Captain Jonas Salvucci, an older, muscular man with little patience for tomfoolery, awaits you—his hand wrapped around the pistol in his holster.\n\nHe takes his hand away from the gun when he sees there’s no threat.\n\n""Get her to sickbay.""\n\nYou nod and help Markie through the hallway of the ship. Behind you, you can hear Salvucci interrogating Meat.\n\n""What happened to Ryan?""\n\n""He's dead, cap. Something got him.""\n\n""Hell, Travis. What did you find down there?""\n\nWhen you get to sickbay, both Lenore Strauss, the doctor, and her geeky assistant Ben are prepping the examination table.\n\n""Where’s she wounded?"" Lenore asks, as you help a woozy Markie out of her suit.  You glare at Ben as he gawks at her well-toned body. He smiles sheepishly and looks away, cheeks burning red with shame. Markie’s drenched in sweat; she stares around wildly while Lenore straps her in.\n\nShe examines the bite: it’s just above the elbow, an inflamed bulging of the skin.\n\n""And I was young and we were running,"" Markie rambles, ""eyes bouncing up and down the shore  while the sun cooked the corpses of washed up jellyfish.""\n\nYou turn to Lenore, who’s prepping some kind of tool.\n\n1.[[""What’s she saying?""]]\n2.[[""What is that?""]]\n\n\n\n"
